Label,Text
1,You have WON a guaranteed £1000 cash or a £2000 prize. To claim yr prize call our customer service representative on 08714712412 between 10am-7pm Cost 10p
1,"Congrats 2 mobile 3G Videophones R yours. call 09063458130 now! videochat wid ur mates, play java games, Dload polypH music, noline rentl. bx420. ip4. 5we. 150p"
1,"Eerie Nokia tones 4u, rply TONE TITLE to 8007 eg TONE DRACULA to 8007 Titles: GHOST, ADDAMSFA, MUNSTERS, EXORCIST, TWILIGHT www.getzed.co.uk POBox36504W45WQ 150p"
1,Congratulations YOU'VE Won. You're a Winner in our August £1000 Prize Draw. Call 09066660100 NOW. Prize Code 2309.
1,"Thank you, winner notified by sms. Good Luck! No future marketing reply STOP to 84122 customer services 08450542832"
1,"Free msg. Sorry, a service you ordered from 81303 could not be delivered as you do not have sufficient credit. Please top up to receive the service."
0,Have you heard about that job? I'm going to that wildlife talk again tonight if u want2come. Its that2worzels and a wizzle or whatever it is?! 
0,Ok lor then we go tog lor...
1,"You are guaranteed the latest Nokia Phone, a 40GB iPod MP3 player or a £500 prize! Txt word: COLLECT to No: 83355! IBHltd LdnW15H 150p/Mtmsgrcvd18"
0,I am getting threats from your sales executive Shifad as i raised complaint against him. Its an official message.
0,"St andre, virgil's cream"
1,"YOU VE WON! Your 4* Costa Del Sol Holiday or £5000 await collection. Call 09050090044 Now toClaim. SAE, TC s, POBox334, Stockport, SK38xh, Cost£1.50/pm, Max10mins"
1,"New Tones This week include: 1)McFly-All Ab.., 2) Sara Jorge-Shock.. 3) Will Smith-Switch.. To order follow instructions on next message"
0,Surely result will offer:)
1,4mths half price Orange line rental & latest camera phones 4 FREE. Had your phone 11mths ? Call MobilesDirect free on 08000938767 to update now! or2stoptxt
1,Save money on wedding lingerie at www.bridal.petticoatdreams.co.uk Choose from a superb selection with national delivery. Brought to you by WeddingFriend
1,"FREE2DAY sexy St George's Day pic of Jordan!Txt PIC to 89080 dont miss out, then every wk a saucy celeb!4 more pics c PocketBabe.co.uk 0870241182716 £3/wk"
1,Dorothy@kiefer.com (Bank of Granite issues Strong-Buy) EXPLOSIVE PICK FOR OUR MEMBERS *****UP OVER 300% *********** Nasdaq Symbol CDGT That is a $5.00 per..
1,"To review and KEEP the fantastic Nokia N-Gage game deck with Club Nokia, go 2 www.cnupdates.com/newsletter. unsubscribe from alerts reply with the word OUT"
0,Eat jap done oso aft ur lect wat... Ü got lect at 12 rite... 
1,"Think ur smart ? Win £200 this week in our weekly quiz, text PLAY to 85222 now!T&Cs WinnersClub PO BOX 84, M26 3UZ. 16+. GBP1.50/week"
1,"URGENT! Your Mobile No was awarded a £2,000 Bonus Caller Prize on 1/08/03! This is our 2nd attempt to contact YOU! Call 0871-4719-523 BOX95QU BT National Rate"
0,"I'm not smoking while people use ""wylie smokes too much"" to justify ruining my shit"
0,"Why is that, princess? I bet the brothas are all chasing you!"
1,I don't know u and u don't know me. Send CHAT to 86688 now and let's find each other! Only 150p/Msg rcvd. HG/Suite342/2Lands/Row/W1J6HL LDN. 18 years or over.
1,FREE UNLIMITED HARDCORE PORN direct 2 your mobile Txt PORN to 69200 & get FREE access for 24 hrs then chrgd@50p per day txt Stop 2exit. This msg is free
1,Well done ENGLAND! Get the official poly ringtone or colour flag on yer mobile! text TONE or FLAG to 84199 NOW! Opt-out txt ENG STOP. Box39822 W111WX £1.50
0,I love to cuddle! I want to hold you in my strong arms right now...
1,Your weekly Cool-Mob tones are ready to download !This weeks new Tones include: 1) Crazy Frog-AXEL F>>> 2) Akon-Lonely>>> 3) Black Eyed-Dont P >>>More info in n
1,For sale - arsenal dartboard. Good condition but no doubles or trebles!
1,December only! Had your mobile 11mths+? You are entitled to update to the latest colour camera mobile for Free! Call The Mobile Update VCo FREE on 08002986906 
0,"Great. I'm in church now, will holla when i get out"
0,Aiyar sorry lor forgot 2 tell u...
0,"K I'm ready,  &lt;#&gt; ?"
0,Yup i thk they r e teacher said that will make my face look longer. Darren ask me not 2 cut too short.
0,Compliments to you. Was away from the system. How your side.
0,Are you going to wipro interview today?
0,No..its ful of song lyrics..
1,85233 FREE>Ringtone!Reply REAL
1,Ringtone Club: Get the UK singles chart on your mobile each week and choose any top quality ringtone! This message is free of charge.
1,Thanks for the Vote. Now sing along with the stars with Karaoke on your mobile. For a FREE link just reply with SING now.
1,You will recieve your tone within the next 24hrs. For Terms and conditions please see Channel U Teletext Pg 750
0,Bishan lar nearer... No need buy so early cos if buy now i gotta park my car...
1,Welcome! Please reply with your AGE and GENDER to begin. e.g 24M
0,Blank is Blank. But wat is blank? Lol
1,Please CALL 08712402972 immediately as there is an urgent message waiting for you
0,Hey... are you going to quit soon? Xuhui and i working till end of the month 
1,"URGENT! Your mobile was awarded a £1,500 Bonus Caller Prize on 27/6/03. Our final attempt 2 contact U! Call 08714714011"
1,FREE entry into our £250 weekly competition just text the word WIN to 80086 NOW. 18 T&C www.txttowin.co.uk
1,URGENT! We are trying to contact U. Todays draw shows that you have won a £2000 prize GUARANTEED. Call 09066358361 from land line. Claim Y87. Valid 12hrs only
0,Hi Princess! Thank you for the pics. You are very pretty. How are you?
0,"Today is ""song dedicated day.."" Which song will u dedicate for me? Send this to all ur valuable frnds but first rply me..."
0,i am going to bed now prin
1,URGENT! We are trying to contact you. Last weekends draw shows that you have won a £900 prize GUARANTEED. Call 09061701851. Claim code K61. Valid 12hours only
0,How many licks does it take to get to the center of a tootsie pop?
1,YOU HAVE WON! As a valued Vodafone customer our computer has picked YOU to win a £150 prize. To collect is easy. Just call 09061743386 
1,Someone U know has asked our dating service 2 contact you! Cant Guess who? CALL 09058091854 NOW all will be revealed. PO BOX385 M6 6WU
1,"Do you ever notice that when you're driving, anyone going slower than you is an idiot and everyone driving faster than you is a maniac?"
0,Pls confirm the time to collect the cheque.
1,"Free Msg: get Gnarls Barkleys ""Crazy"" ringtone TOTALLY FREE just reply GO to this message right now!"
1,Urgent Please call 09066612661 from landline. £5000 cash or a luxury 4* Canary Islands Holiday await collection. T&Cs SAE award. 20M12AQ. 150ppm. 16+ “
1,URGENT! Your Mobile number has been awarded with a £2000 prize GUARANTEED. Call 09061790121 from land line. Claim 3030. Valid 12hrs only 150ppm
1,"Thanks for your ringtone order, ref number K718. Your mobile will be charged £4.50. Should your tone not arrive please call customer services on 09065069120"
1,Free Msg: Ringtone!From: http://tms. widelive.com/index. wml?id=1b6a5ecef91ff9*37819&first=true18:0430-JUL-05
1,Missed call alert. These numbers called but left no message. 07008009200
0,Okay lor... Will they still let us go a not ah? Coz they will not know until later. We drop our cards into the box right?
0,I am not having her number sir
0,"Sorry, I'll call later"
1,"Hello darling how are you today? I would love to have a chat, why dont you tell me what you look like and what you are in to sexy?"
0,I like you peoples very much:) but am very shy pa.
1,Reply with your name and address and YOU WILL RECEIVE BY POST a weeks completely free accommodation at various global locations www.phb1.com ph:08700435505150p
1,"URGENT! Last weekend's draw shows that you have won £1000 cash or a Spanish holiday! CALL NOW 09050000332 to claim. T&C: RSTM, SW7 3SS. 150ppm"
1,Ur cash-balance is currently 500 pounds - to maximize ur cash-in now send GO to 86688 only 150p/meg. CC: 08718720201 HG/Suite342/2lands Row/W1j6HL
1,Cashbin.co.uk (Get lots of cash this weekend!) www.cashbin.co.uk Dear Welcome to the weekend We have got our biggest and best EVER cash give away!! These..
0,A pure hearted person can have a wonderful smile that makes even his/her enemies to feel guilty for being an enemy.. So catch the world with your smile..:) GOODMORNING &amp; HAVE A SMILEY SUNDAY..:)
1,BIG BROTHER ALERT! The computer has selected u for 10k cash or #150 voucher. Call 09064018838. NTT PO Box CRO1327 18+ BT Landline Cost 150ppm mobiles vary
1,"Shop till u Drop, IS IT YOU, either 10K, 5K, £500 Cash or £100 Travel voucher, Call now, 09064011000. NTT PO Box CR01327BT fixedline Cost 150ppm mobile vary"
0,I wnt to buy a BMW car urgently..its vry urgent.but hv a shortage of  &lt;#&gt; Lacs.there is no source to arng dis amt. &lt;#&gt; lacs..thats my prob
0,There are many company. Tell me the language.
1,"You've won tkts to the EURO2004 CUP FINAL or £800 CASH, to collect CALL 09058099801 b4190604, POBOX 7876150ppm"
0,"Damn, can you make it tonight or do you want to just wait til tomorrow"
1,Ur cash-balance is currently 500 pounds - to maximize ur cash-in now send CASH to 86688 only 150p/msg. CC: 08708800282 HG/Suite342/2Lands Row/W1J6HL
1,You won't believe it but it's true. It's Incredible Txts! Reply G now to learn truly amazing things that will blow your mind. From O2FWD only 18p/txt
0,Wait . I will msg after  &lt;#&gt;  min.
1,"Urgent! call 09066612661 from landline. Your complementary 4* Tenerife Holiday or £10,000 cash await collection SAE T&Cs PO Box 3 WA14 2PX 150ppm 18+ Sender: Hol Offer"
0,I send the print  outs da.
1,"Double mins and txts 4 6months FREE Bluetooth on Orange. Available on Sony, Nokia Motorola phones. Call MobileUpd8 on 08000839402 or call2optout/N9DX"
1,"Hey Boys. Want hot XXX pics sent direct 2 ur phone? Txt PORN to 69855, 24Hrs free and then just 50p per day. To stop text STOPBCM SF WC1N3XX"
0,I'm sick !! I'm needy !! I want you !! *pouts* *stomps feet* Where are you ?! *pouts* *stomps feet* I want my slave !! I want him now !!
0,My uncles in Atlanta. Wish you guys a great semester.
0,Think I could stop by in like an hour or so? My roommate's looking to stock up for a trip
1,Dear Voucher holder Have your next meal on us. Use the following link on your pc 2 enjoy a 2 4 1 dining experiencehttp://www.vouch4me.com/etlp/dining.asp
0,If u dun drive then how i go 2 sch.
0,"Geeee ... I miss you already, you know ? Your all I can think about. Fuck, I can't wait till next year when we will be together ... *loving kiss*"
1,December only! Had your mobile 11mths+? You are entitled to update to the latest colour camera mobile for Free! Call The Mobile Update Co FREE on 08002986906
1,Wanna have a laugh? Try CHIT-CHAT on your mobile now! Logon by txting the word: CHAT and send it to No: 8883 CM PO Box 4217 London W1A 6ZF 16+ 118p/msg rcvd
1,Burger King - Wanna play footy at a top stadium? Get 2 Burger King before 1st Sept and go Large or Super with Coca-Cola and walk out a winner
0,How much is torch in 9ja.
0,"Dont search love, let love find U. Thats why its called falling in love, bcoz U dont force yourself, U just fall and U know there is smeone to hold U... BSLVYL"
1,"Got what it takes 2 take part in the WRC Rally in Oz? U can with Lucozade Energy! Text RALLY LE to 61200 (25p), see packs or lucozade.co.uk/wrc & itcould be u!"
0,Haha okay... Today weekend leh... 
0,"When people see my msgs, They think Iam addicted to msging... They are wrong, Bcoz They don\'t know that Iam addicted to my sweet Friends..!! BSLVYL"
1,Ur cash-balance is currently 500 pounds - to maximize ur cash-in now send CASH to 86688 only 150p/msg. CC: 08718720201 PO BOX 114/14 TCR/W1
1,Free entry in 2 a weekly comp for a chance to win an ipod. Txt POD to 80182 to get entry (std txt rate) T&C's apply 08452810073 for details 18+
0,No sir. That's why i had an 8-hr trip on the bus last week. Have another audition next wednesday but i think i might drive this time.
1,"Congratulations - Thanks to a good friend U have WON the £2,000 Xmas prize. 2 claim is easy, just call 08712103738 NOW! Only 10p per minute. BT-national-rate"
0,Great to hear you are settling well. So what's happenin wit ola?
1,FREE>Ringtone! Reply REAL or POLY eg REAL1 1. PushButton 2. DontCha 3. BabyGoodbye 4. GoldDigger 5. WeBeBurnin 1st tone FREE and 6 more when u join for £3/wk
1,Phony £350 award - Todays Voda numbers ending XXXX are selected to receive a £350 award. If you have a match please call 08712300220 quoting claim code 3100 standard rates app
1,Show ur colours! Euro 2004 2-4-1 Offer! Get an England Flag & 3Lions tone on ur phone! Click on the following service message for info!
0,Ok lor... Sony ericsson salesman... I ask shuhui then she say quite gd 2 use so i considering...
1,UR awarded a City Break and could WIN a £200 Summer Shopping spree every WK. Txt STORE to 88039 . SkilGme. TsCs087147403231Winawk!Age16 £1.50perWKsub
1,"Hello from Orange. For 1 month's free access to games, news and sport, plus 10 free texts and 20 photo messages, reply YES. Terms apply: www.orange.co.uk/ow"
1,"FREE MESSAGE Activate your 500 FREE Text Messages by replying to this message with the word FREE For terms & conditions, visit www.07781482378.com"
0,"Hmm ok, i'll stay for like an hour cos my eye is really sore!"
0,Then why you came to hostel.
0,Your gonna have to pick up a $1 burger for yourself on your way home. I can't even move. Pain is killing me.
1,Do you want a New Nokia 3510i colour phone DeliveredTomorrow? With 300 free minutes to any mobile + 100 free texts + Free Camcorder reply or call 08000930705
0,I have many dependents
1,"Thanks for your Ringtone Order, Reference T91. You will be charged GBP 4 per week. You can unsubscribe at anytime by calling customer services on 09057039994"
0,That is wondarfull song
1,Free entry in 2 a wkly comp to win FA Cup final tkts 21st May 2005. Text FA to 87121 to receive entry question(std txt rate)T&C's apply 08452810075over18's
0,"Call me when you/carlos is/are here, my phone's vibrate is acting up and I might not hear texts"
0,Tell me whos this pls:-)
1,we tried to contact you re your response to our offer of a new nokia fone and camcorder hit reply or call 08000930705 for delivery
1,U 447801259231 have a secret admirer who is looking 2 make contact with U-find out who they R*reveal who thinks UR so special-call on 09058094597
0,"1) Go to write msg 2) Put on Dictionary mode 3)Cover the screen with hand, 4)Press  &lt;#&gt; . 5)Gently remove Ur hand.. Its interesting..:)"
1,UR GOING 2 BAHAMAS! CallFREEFONE 08081560665 and speak to a live operator to claim either Bahamas cruise of£2000 CASH 18+only. To opt out txt X to 07786200117
0,Aight should I just plan to come up later tonight?
1,"Urgent! call 09061749602 from Landline. Your complimentary 4* Tenerife Holiday or £10,000 cash await collection SAE T&Cs BOX 528 HP20 1YF 150ppm 18+"
0,"Love isn't a decision, it's a feeling. If we could decide who to love, then, life would be much simpler, but then less magical"
1,http//tms. widelive.com/index. wml?id=820554ad0a1705572711&first=true¡C C Ringtone¡
0,So what do you guys do.
0,Thanx 4 2day! U r a goodmate I THINK UR RITE SARY! ASUSUAL!1 U CHEERED ME UP! LOVE U FRANYxxxxx
0,I'm in a movie. Call me 4 wat?
1,"URGENT!! Your 4* Costa Del Sol Holiday or £5000 await collection. Call 09050090044 Now toClaim. SAE, TC s, POBox334, Stockport, SK38xh, Cost£1.50/pm, Max10mins"
0,Happy New year my dear brother. I really do miss you. Just got your number and decided to send you this text wishing you only happiness. Abiola
1,"URGENT!! Your 4* Costa Del Sol Holiday or £5000 await collection. Call 09050090044 Now toClaim. SAE, TC s, POBox334, Stockport, SK38xh, Cost£1.50/pm, Max10mins"
1,100 dating service cal;l 09064012103 box334sk38ch
1,"Auction round 4. The highest bid is now £54. Next maximum bid is £71. To bid, send BIDS e. g. 10 (to bid £10) to 83383. Good luck."
1,You have won a guaranteed 32000 award or maybe even £1000 cash to claim ur award call free on 0800 ..... (18+). Its a legitimat efreefone number wat do u think???
0,I reach home safe n sound liao...
0,Did u download the fring app?
0,NONE!NOWHERE IKNO DOESDISCOUNT!SHITINNIT
1,"Thanks for your ringtone order, reference number X49. Your mobile will be charged 4.50. Should your tone not arrive please call customer services 09065989182. From: [colour=red]text[/colour]TXTstar"
1,Get ur 1st RINGTONE FREE NOW! Reply to this msg with TONE. Gr8 TOP 20 tones to your phone every week just £1.50 per wk 2 opt out send STOP 08452810071 16
0,I can't make it tonight
1,Someone has contacted our dating service and entered your phone because they fancy you! To find out who it is call from a landline 09111032124 . PoBox12n146tf150p
0,Hey so this sat are we going for the intro pilates only? Or the kickboxing too? 
1,Not heard from U4 a while. Call 4 rude chat private line 01223585334 to cum. Wan 2C pics of me gettin shagged then text PIX to 8552. 2End send STOP 8552 SAM xxx
1,"You are being contacted by our dating service by someone you know! To find out who it is, call from a land line 09050000928. PoBox45W2TG150P"
0,At WHAT TIME should i come tomorrow
1,Thanks for your subscription to Ringtone UK your mobile will be charged £5/month Please confirm by replying YES or NO. If you reply NO you will not be charged
1,"We know someone who you know that fancies you. Call 09058097218 to find out who. POBox 6, LS15HB 150p"
1,Someonone you know is trying to contact you via our dating service! To find out who it could be call from your mobile or landline 09064015307 BOX334SK38ch 
0,"Yeah, I'll leave in a couple minutes &amp; let you know when I get to mu"
1,Sexy Singles are waiting for you! Text your AGE followed by your GENDER as wither M or F E.G.23F. For gay men text your AGE followed by a G. e.g.23G.
0,Lol! Nah wasn't too bad thanks. Its good to b home but its been quite a reality check. Hows ur day been? Did u do anything with website?
0,I got a call from a landline number. . . I am asked to come to anna nagar . . . I will go in the afternoon
1,Congrats! Nokia 3650 video camera phone is your Call 09066382422 Calls cost 150ppm Ave call 3mins vary from mobiles 16+ Close 300603 post BCM4284 Ldn WC1N3XX
0,Ok i msg u b4 i leave my house.
1,"Rock yr chik. Get 100's of filthy films &XXX pics on yr phone now. rply FILTH to 69669. Saristar Ltd, E14 9YT 08701752560. 450p per 5 days. Stop2 cancel"
1,What do U want for Xmas? How about 100 free text messages & a new video phone with half price line rental? Call free now on 0800 0721072 to find out more!
1,Urgent! Please call 09061213237 from landline. £5000 cash or a luxury 4* Canary Islands Holiday await collection. T&Cs SAE PO Box 177. M227XY. 150ppm. 16+
1,"Welcome to Select, an O2 service with added benefits. You can now call our specially trained advisors FREE from your mobile by dialling 402."
1,"FREE MESSAGE Activate your 500 FREE Text Messages by replying to this message with the word FREE For terms & conditions, visit www.07781482378.com"
0,"I don't think I can get away for a trek that long with family in town, sorry"
1,Do you want 750 anytime any network mins 150 text and a NEW VIDEO phone for only five pounds per week call 08002888812 or reply for delivery tomorrow
0,What to think no one saying clearly. Ok leave no need to ask her. I will go if she come or not
0,In the end she might still vomit but its okay. Not everything will come out.
0,What you doing?how are you?
0,Am watching house – very entertaining – am getting the whole hugh laurie thing – even with the stick – indeed especially with the stick.
1,"This is the 2nd time we have tried 2 contact u. U have won the 750 Pound prize. 2 claim is easy, call 08712101358 NOW! Only 10p per min. BT-national-rate"
0,I got your back! Do you have any dislikes in bed?
1,Do you want a New Nokia 3510i Colour Phone Delivered Tomorrow? With 200 FREE minutes to any mobile + 100 FREE text + FREE camcorder Reply or Call 08000930705
0,I am joining today formally.Pls keep praying.will talk later.
1,"449050000301 You have won a £2,000 price! To claim, call 09050000301."
1,Natalja (25/F) is inviting you to be her friend. Reply YES-440 or NO-440 See her: www.SMS.ac/u/nat27081980 STOP? Send STOP FRND to 62468
0,Nope but i'll b going 2 sch on fri quite early lor cos mys sis got paper in da morn :-)
1,U’ve Bin Awarded £50 to Play 4 Instant Cash. Call 08715203028 To Claim. EVERY 9th Player Wins Min £50-£500. OptOut 08718727870
0,Argh why the fuck is nobody in town ;_;
1,"TheMob>Hit the link to get a premium Pink Panther game, the new no. 1 from Sugababes, a crazy Zebra animation or a badass Hoody wallpaper-all 4 FREE!"
0,Hello beautiful r u ok? I've kinda ad a row wiv and he walked out the pub?? I wanted a night wiv u Miss u 
1,07732584351 - Rodger Burns - MSG = We tried to call you re your reply to our sms for a free nokia mobile + free camcorder. Please call now 08000930705 for delivery tomorrow
0,"I've not called you in a while. This is hoping it was l8r malaria and that you know that we miss you guys. I miss Bani big, so pls give her my love especially. Have a great day."
0,Hey pple...$700 or $900 for 5 nights...Excellent location wif breakfast hamper!!!
1,"Hungry gay guys feeling hungry and up 4 it, now. Call 08718730555 just 10p/min. To stop texts call 08712460324 (10p/min)"
0,"After my work ah... Den 6 plus lor... U workin oso rite... Den go orchard lor, no other place to go liao..."
1,"Win the newest “Harry Potter and the Order of the Phoenix (Book 5) reply HARRY, answer 5 questions - chance to be the first among readers!"
0,Ok im not sure what time i finish tomorrow but i wanna spend the evening with you cos that would be vewy vewy lubly! Love me xxx
0,Sorry dude. Dont know how i forgot. Even after Dan reminded me. Sorry. Hope you guys had fun.
1,5p 4 alfie Moon's Children in need song on ur mob. Tell ur m8s. Txt Tone charity to 8007 for Nokias or Poly charity for polys: zed 08701417012 profit 2 charity.
1,"For ur chance to win a £250 wkly shopping spree TXT: SHOP to 80878. T's&C's www.txt-2-shop.com custcare 08715705022, 1x150p/wk"
0,"New Theory: Argument wins d SITUATION, but loses the PERSON. So dont argue with ur friends just.. . . . kick them &amp; say, I'm always correct.!"
0,I knew it... U slept v late yest? Wake up so late...
0,U attend ur driving lesson how many times a wk n which day?
0,Hey hun-onbus goin 2 meet him. He wants 2go out 4a meal but I donyt feel like it cuz have 2 get last bus home!But hes sweet latelyxxx
0,Huh i cant thk of more oredi how many pages do we have?
1,500 free text msgs. Just text ok to 80488 and we'll credit your account
0,"Hmmm.. Thk sure got time to hop ard... Ya, can go 4 free abt... Muz call u to discuss liao... "
0,Thank you princess! You are so sexy...
1,You have an important customer service announcement. Call FREEPHONE 0800 542 0825 now!
1,No. 1 Nokia Tone 4 ur mob every week! Just txt NOK to 87021. 1st Tone FREE ! so get txtin now and tell ur friends. 150p/tone. 16 reply HL 4info
1,Get the official ENGLAND poly ringtone or colour flag on yer mobile for tonights game! Text TONE or FLAG to 84199. Optout txt ENG STOP Box39822 W111WX £1.50
0,Waiting in e car 4 my mum lor. U leh? Reach home already?
0,Was playng 9 doors game and gt racing on phone lol
0,No need to buy lunch for me.. I eat maggi mee..
1,XMAS Prize draws! We are trying to contact U. Todays draw shows that you have won a £2000 prize GUARANTEED. Call 09058094565 from land line. Valid 12hrs only
1,"HOT LIVE FANTASIES call now 08707509020 Just 20p per min NTT Ltd, PO Box 1327 Croydon CR9 5WB 0870..k"
1,HMV BONUS SPECIAL 500 pounds of genuine HMV vouchers to be won. Just answer 4 easy questions. Play Now! Send HMV to 86688 More info:www.100percent-real.com
1,We tried to call you re your reply to our sms for a video mobile 750 mins UNLIMITED TEXT + free camcorder Reply of call 08000930705 Now
1,"This is the 2nd time we have tried 2 contact u. U have won the £750 Pound prize. 2 claim is easy, call 087187272008 NOW1! Only 10p per minute. BT-national-rate."
1,"This is the 2nd time we have tried 2 contact u. U have won the 750 Pound prize. 2 claim is easy, call 08718726970 NOW! Only 10p per min. BT-national-rate "
0,How are you doing? Hope you've settled in for the new school year. Just wishin you a gr8 day
0,Hey loverboy! I love you !! I had to tell ... I look at your picture and ache to feel you between my legs ... Fuck I want you ... I need you ... I crave you .
1,Hello. We need some posh birds and chaps to user trial prods for champneys. Can i put you down? I need your address and dob asap. Ta r
0,"Alright, we're all set here, text the man"
0,Anytime...
0,U coming back 4 dinner rite? Dad ask me so i re confirm wif u...
0,"Hmmm... Guess we can go 4 kb n power yoga... Haha, dunno we can tahan power yoga anot... Thk got lo oso, forgot liao..."
0,I'm on my way home. Went to change batt 4 my watch then go shop a bit lor.
0,Joy's father is John. Then John is the NAME of Joy's father. Mandan
1,"URGENT! Your Mobile No. was awarded £2000 Bonus Caller Prize on 5/9/03 This is our final try to contact U! Call from Landline 09064019788 BOX42WR29C, 150PPM"
0,Hey... What time is your driving on fri? We go for evaluation on fri?
0,Thought praps you meant another one. Goodo! I'll look tomorrow 
1,"TheMob> Check out our newest selection of content, Games, Tones, Gossip, babes and sport, Keep your mobile fit and funky text WAP to 82468"
0," came to look at the flat, seems ok, in his 50s? * Is away alot wiv work. Got woman coming at 6.30 too."
1,"500 New Mobiles from 2004, MUST GO! Txt: NOKIA to No: 89545 & collect yours today!From ONLY £1 www.4-tc.biz 2optout 087187262701.50gbp/mtmsg18 TXTAUCTION"
0,Hope youre not having too much fun without me!! see u tomorrow love jess x
