Label,Text
1,"URGENT, IMPORTANT INFORMATION FOR O2 USER. TODAY IS YOUR LUCKY DAY! 2 FIND OUT WHY LOG ONTO HTTP://WWW.URAWINNER.COM THERE IS A FANTASTIC SURPRISE AWAITING FOR YOU"
1,Panasonic & BluetoothHdset FREE. Nokia FREE. Motorola FREE & DoubleMins & DoubleTxt on Orange contract. Call MobileUpd8 on 08000839402 or call 2optout
1,Do you want a new Video handset? 750 any time any network mins? UNLIMITED TEXT? Camcorder? Reply or Call now 08000930705 for del Sat AM
1,Hi if ur lookin 4 saucy daytime fun wiv busty married woman Am free all next week Chat now 2 sort time 09099726429 JANINExx Calls£1/minMobsmoreLKPOBOX177HP51FL
1,"09066362231 URGENT! Your mobile No 07xxxxxxxxx won a £2,000 bonus caller prize on 02/06/03! this is the 2nd attempt to reach YOU! call 09066362231 ASAP!"
0,Dai i downloaded but there is only exe file which i can only run that exe after installing.
0,I ain't answerin no phone at what is actually a pretty reasonable hour but I'm sleepy
0,Ok...
0,I know but you need to get hotel now. I just got my invitation but i had to apologise. Cali is to sweet for me to come to some english bloke's weddin
0,Lol yes. Our friendship is hanging on a thread cause u won't buy stuff.
1,U have a secret admirer who is looking 2 make contact with U-find out who they R*reveal who thinks UR so special-call on 09058094594
0,I am waiting for your call sir.
1,"Free-message: Jamster!Get the crazy frog sound now! For poly text MAD1, for real text MAD2 to 88888. 6 crazy sounds for just 3 GBP/week! 16+only! T&C's apply"
1,PRIVATE! Your 2003 Account Statement for shows 800 un-redeemed S. I. M. points. Call 08718738002 Identifier Code: 48922 Expires 21/11/04
0,Ü eatin later but i'm eatin wif my frens now lei... Ü going home first? 
0,Ok. There may be a free gym about.
1,URGENT! Your Mobile number has been awarded with a £2000 prize GUARANTEED. Call 09058094455 from land line. Claim 3030. Valid 12hrs only
0,"Indians r poor but India is not a poor country. Says one of the swiss bank directors. He says that "" &lt;#&gt;  lac crore"" of Indian money is deposited in swiss banks which can be used for 'taxless' budget for  &lt;#&gt;  yrs. Can give  &lt;#&gt;  crore jobs to all Indians. From any village to Delhi 4 lane roads. Forever free power suply to more than  &lt;#&gt;  social projects. Every citizen can get monthly  &lt;#&gt; /- for  &lt;#&gt;  yrs. No need of World Bank &amp; IMF loan. Think how our money is blocked by rich politicians. We have full rights against corrupt politicians. Itna forward karo ki pura INDIA padhe.g.m."""
1,Do you want a NEW video phone750 anytime any network mins 150 text for only five pounds per week call 08000776320 now or reply for delivery tomorrow
0,Oh just getting even with u.... u?
0,No way I'm going back there!
1,URGENT! We are trying to contact you. Last weekends draw shows that you have won a £900 prize GUARANTEED. Call 09061701939. Claim code S89. Valid 12hrs only
0,Okie... Thanx...
0,Oh thats late! Well have a good night and i will give u a call tomorrow. Iam now going to go to sleep night night
0,"Sounds gd... Haha... Can... Wah, u yan jiu so fast liao..."
1,"As a valued customer, I am pleased to advise you that following recent review of your Mob No. you are awarded with a £1500 Bonus Prize, call 09066364589"
1,SMS AUCTION - A BRAND NEW Nokia 7250 is up 4 auction today! Auction is FREE 2 join & take part! Txt NOKIA to 86021 now!
1,"u r subscribed 2 TEXTCOMP 250 wkly comp. 1st wk?s free question follows, subsequent wks charged@150p/msg.2 unsubscribe txt STOP 2 84128,custcare 08712405020"
1,"SIX chances to win CASH! From 100 to 20,000 pounds txt> CSH11 and send to 87575. Cost 150p/day, 6days, 16+ TsandCs apply Reply HL 4 info"
0,Please attend the phone:)
0,"Hello, my love! How goes that day ? I wish your well and fine babe and hope that you find some job prospects. I miss you, boytoy ... *a teasing kiss*"
0,Yup ok...
1,Valentines Day Special! Win over £1000 in our quiz and take your partner on the trip of a lifetime! Send GO to 83600 now. 150p/msg rcvd. CustCare:08718720201.
1,Someone has conacted our dating service and entered your phone because they fancy you!To find out who it is call from landline 09111030116. PoBox12n146tf15
1,FREE for 1st week! No1 Nokia tone 4 ur mob every week just txt NOKIA to 8007 Get txting and tell ur mates www.getzed.co.uk POBox 36504 W45WQ norm150p/tone 16+
1,"URGENT! You have won a 1 week FREE membership in our £100,000 Prize Jackpot! Txt the word: CLAIM to No: 81010 T&C www.dbuk.net LCCLTD POBOX 4403LDNW1A7RW18"
0,I know complain num only..bettr directly go to bsnl offc nd apply for it..
1,Get your garden ready for summer with a FREE selection of summer bulbs and seeds worth £33:50 only with The Scotsman this Saturday. To stop go2 notxt.co.uk
0,"Theoretically yeah, he could be able to come"
0,"Thanks, I'll keep that in mind"
0,Love you aathi..love u lot..
1,You'll not rcv any more msgs from the chat svc. For FREE Hardcore services text GO to: 69988 If u get nothing u must Age Verify with yr network & try again
1,Reminder: You have not downloaded the content you have already paid for. Goto http://doit. mymoby. tv/ to collect your content.
1,Sorry I missed your call let's talk when you have the time. I'm on 07090201529
1,"Bears Pic Nick, and Tom, Pete and ... Dick. In fact, all types try gay chat with photo upload call 08718730666 (10p/min). 2 stop texts call 08712460324"
0,No da. . Vijay going to talk in jaya tv
1,Hi I'm sue. I am 20 years old and work as a lapdancer. I love sex. Text me live - I'm i my bedroom now. text SUE to 89555. By TextOperator G2 1DA 150ppmsg 18+
1,"SMS SERVICES. for your inclusive text credits, pls goto www.comuk.net login= ***** unsubscribe with STOP. no extra charge. help:08700469649. PO BOX420. IP4 5WE"
0,"Time n Smile r the two crucial things in our life. Sometimes time makes us to forget smile, and sometimes someone's smile makes us to forget time gud noon"
1,Do you want a new Video phone? 600 anytime any network mins 400 Inclusive Video calls AND downloads 5 per week Free delTOMORROW call 08002888812 or reply NOW
0,About  &lt;#&gt; bucks. The banks fees are fixed. Better to call the bank and find out.
1,"Congrats 2 mobile 3G Videophones R yours. call 09063458130 now! videochat wid ur mates, play java games, Dload polypH music, noline rentl. bx420. ip4. 5we. 150p"
0,You said not now. No problem. When you can. Let me know.
0,Then u drive lor.
1,2p per min to call Germany 08448350055 from your BT line. Just 2p per min. Check PlanetTalkInstant.com for info & T's & C's. Text stop to opt out
0,Wat time ü wan today?
0,We'll join the  &lt;#&gt;  bus
1,Want explicit SEX in 30 secs? Ring 02073162414 now! Costs 20p/min
0,How come she can get it? Should b quite diff to guess rite...
0,Ü give me some time to walk there.
0,It will stop on itself. I however suggest she stays with someone that will be able to give ors for every stool.
1,For the most sparkling shopping breaks from 45 per person; call 0121 2025050 or visit www.shortbreaks.org.uk
1,Wanna get laid 2nite? Want real Dogging locations sent direct to ur mobile? Join the UK's largest Dogging Network. Txt PARK to 69696 now! Nyt. ec2a. 3lp £1.50/msg
0,Hope ur head doesn't hurt 2 much ! Am ploughing my way through a pile of ironing ! Staying in with a chinky tonight come round if you like.
1,Well done ENGLAND! Get the official poly ringtone or colour flag on yer mobile! text TONE or FLAG to 84199 NOW! Opt-out txt ENG STOP. Box39822 W111WX £1.50
1,Call Germany for only 1 pence per minute! Call from a fixed line via access number 0844 861 85 85. No prepayment. Direct access! www.telediscount.co.uk
1,Sorry! U can not unsubscribe yet. THE MOB offer package has a min term of 54 weeks> pls resubmit request after expiry. Reply THEMOB HELP 4 more info
0,Was it something u ate?
0,Dear where you will be when i reach there
1,We tried to contact you re your reply to our offer of a Video Handset? 750 anytime networks mins? UNLIMITED TEXT? Camcorder? Reply or call 08000930705 NOW
0,Bring tat cd don forget
1,Get a brand new mobile phone by being an agent of The Mob! Plus loads more goodies! For more info just text MAT to 87021.
1,Monthly password for wap. mobsi.com is 391784. Use your wap phone not PC.
0,Oh baby of the house. How come you dont have any new pictures on facebook
1,FreeMsg: Hey - I'm Buffy. 25 and love to satisfy men. Home alone feeling randy. Reply 2 C my PIX! QlynnBV Help08700621170150p a msg Send stop to stop txts
0,I think steyn surely get one wicket:)
0,"I'm in a meeting, call me later at"
0,Lol your right. What diet? Everyday I cheat anyway. I'm meant to be a fatty :(
0,"Oh, my love, it's soooo good to hear from you. Omg I missed you so much today. I'm sorry your having problems with the provider but thank you for tming me"
0,Are you available for soiree on June 3rd?
1,YES! The only place in town to meet exciting adult singles is now in the UK. Txt CHAT to 86688 now! 150p/Msg.
0,"wiskey Brandy Rum Gin Beer Vodka Scotch Shampain Wine ""KUDI""yarasu dhina vaazhthukkal. .."
0,Is it ok if I stay the night here? Xavier has a sleeping bag and I'm getting tired
1,u r a winner U ave been specially selected 2 receive £1000 cash or a 4* holiday (flights inc) speak to a live operator 2 claim 0871277810710p/min (18 )
0,Can you let me know details of fri when u find out cos I'm not in tom or fri. mentionned chinese. Thanks
0,Goin to workout lor... Muz lose e fats... 
1,Ur balance is now £500. Ur next question is: Who sang 'Uptown Girl' in the 80's ? 2 answer txt ur ANSWER to 83600. Good luck!
1,A link to your picture has been sent. You can also use http://alto18.co.uk/wave/wave.asp?o=44345
0,Howz that persons story
1,Promotion Number: 8714714 - UR awarded a City Break and could WIN a £200 Summer Shopping spree every WK. Txt STORE to 88039 . SkilGme. TsCs087147403231Winawk!Age16 £1.50perWKsub
1,You have WON a guaranteed £1000 cash or a £2000 prize.To claim yr prize call our customer service representative on
1,Congratulations ur awarded 500 of CD vouchers or 125gift guaranteed & Free entry 2 100 wkly draw txt MUSIC to 87066
0,Sorry i now then c ur msg... Yar lor so poor thing... But only 4 one night... Tmr u'll have a brand new room 2 sleep in...
1,GENT! We are trying to contact you. Last weekends draw shows that you won a £1000 prize GUARANTEED. Call 09064012160. Claim Code K52. Valid 12hrs only. 150ppm
0,"Keep ur problems in ur heart, b'coz nobody will fight for u. Only u &amp; u have to fight for ur self &amp; win the battle. -VIVEKANAND- G 9t.. SD..
ham	Yeah, give me a call if you've got a minute
ham	HI BABE UAWAKE?FEELLIKW SHIT.JUSTFOUND OUT VIA ALETTER THATMUM GOTMARRIED 4thNOV.BEHIND OURBACKS  FUCKINNICE!SELFISH,DEVIOUSBITCH.ANYWAY,IL CALL U"""
1,"URGENT! You have won a 1 week FREE membership in our £100,000 Prize Jackpot! Txt the word: CLAIM to No: 81010 T&C www.dbuk.net LCCLTD POBOX 4403LDNW1A7RW18"
0,Were trying to find a Chinese food place around here
0,Then ü ask dad to pick ü up lar... Ü wan 2 stay until 6 meh...
1,EASTENDERS TV Quiz. What FLOWER does DOT compare herself to? D= VIOLET E= TULIP F= LILY txt D E or F to 84025 NOW 4 chance 2 WIN £100 Cash WKENT/150P16+
1,"Congrats! 1 year special cinema pass for 2 is yours. call 09061209465 now! C Suprman V, Matrix3, StarWars3, etc all 4 FREE! bx420-ip4-5we. 150pm. Dont miss out!"
0,Give one miss from that number please
0,Hi darlin i cantdo anythingtomorrow as myparents aretaking me outfor a meal. when are u free? Katexxx
1,SMS. ac Sptv: The New Jersey Devils and the Detroit Red Wings play Ice Hockey. Correct or Incorrect? End? Reply END SPTV
1,22 days to kick off! For Euro2004 U will be kept up to date with the latest news and results daily. To be removed send GET TXT STOP to 83222
1,"Urgent! call 09066350750 from your landline. Your complimentary 4* Ibiza Holiday or 10,000 cash await collection SAE T&Cs PO BOX 434 SK3 8WP 150 ppm 18+"
0,"Sorry that took so long, omw now"
0,"What i mean was i left too early to check, cos i'm working a 9-6."
0,That one week leave i put know that time. Why.
0,"Good afternoon, my love. How goes your day ? What are you up to ? I woke early and am online waiting for you ... Hmmm ... Italian boy is online I see . *grins*"
0,"life alle mone,eppolum oru pole allalo"
0,S.s:)i thinl role is like sachin.just standing. Others have to hit.
1,Free Top ringtone -sub to weekly ringtone-get 1st week free-send SUBPOLY to 81618-?3 per week-stop sms-08718727870
1,"our mobile number has won £5000, to claim calls us back or ring the claims hot line on 09050005321."
1,"Your free ringtone is waiting to be collected. Simply text the password ""MIX"" to 85069 to verify. Get Usher and Britney. FML, PO Box 5249, MK17 92H. 450Ppw 16"
0,Am surfing online store. For offers do you want to buy any thing.
1,Married local women looking for discreet action now! 5 real matches instantly to your phone. Text MATCH to 69969 Msg cost 150p 2 stop txt stop BCMSFWC1N3XX
1,Knock Knock Txt whose there to 80082 to enter r weekly draw 4 a £250 gift voucher 4 a store of yr choice. T&Cs www.tkls.com age16 to stoptxtstop£1.50/week
1,Santa Calling! Would your little ones like a call from Santa Xmas eve? Call 09058094583 to book your time.
0,Mmmm.... I cant wait to lick it!
1,SMS SERVICES For your inclusive text credits pls gotto www.comuk.net login 3qxj9 unsubscribe with STOP no extra charge help 08702840625 comuk.220cm2 9AE
1,"Goal! Arsenal 4 (Henry, 7 v Liverpool 2 Henry scores with a simple shot from 6 yards from a pass by Bergkamp to give Arsenal a 2 goal margin after 78 mins."
0,"Just checked out, heading out to drop off my stuff now"
1,"You are being contacted by our Dating Service by someone you know! To find out who it is, call from your mobile or landline 09064017305 PoBox75LDNS7 "
1,ree entry in 2 a weekly comp for a chance to win an ipod. Txt POD to 80182 to get entry (std txt rate) T&C's apply 08452810073 for details 18+
0,As per your request 'Melle Melle (Oru Minnaminunginte Nurungu Vettam)' has been set as your callertune for all Callers. Press *9 to copy your friends Callertune
0,What class of  &lt;#&gt;  reunion?
1,"Eerie Nokia tones 4u, rply TONE TITLE to 8007 eg TONE DRACULA to 8007 Titles: GHOST, ADDAMSFA, MUNSTERS, EXORCIST, TWILIGHT www.getzed.co.uk POBox36504W45WQ 150p "
0,Sounds like something that someone testing me would sayy
0,Wah lucky man... Then can save money... Hee...
0,Nope. Meanwhile she talk say make i greet you.
0,HI DARLIN IM MISSIN U HOPE YOU ARE HAVING A GOOD TIME. WHEN ARE U BACK AND WHAT TIME IF U CAN GIVE ME A CALL AT HOME. JESS XX
0,I've told you everything will stop. Just dont let her get dehydrated.
1,"Last Chance! Claim ur £150 worth of discount vouchers today! Text SHOP to 85023 now! SavaMob, offers mobile! T Cs SavaMob POBOX84, M263UZ. £3.00 Sub. 16"
1,"You are guaranteed the latest Nokia Phone, a 40GB iPod MP3 player or a £500 prize! Txt word: COLLECT to No: 83355! IBHltd LdnW15H 150p/Mtmsgrcvd18+"
0,At the funeral home with Audrey and dad
0,U R THE MOST BEAUTIFUL GIRL IVE EVER SEEN. U R MY BABY COME AND C ME IN THE COMMON ROOM
1,"Hi babe its Jordan, how r u? Im home from abroad and lonely, text me back if u wanna chat xxSP visionsms.com Text stop to stopCost 150p 08712400603"
1,Please call our customer service representative on 0800 169 6031 between 10am-9pm as you have WON a guaranteed £1000 cash or £5000 prize!
1,You have 1 new voicemail. Please call 08719181513.
0,"They can try! They can get lost, in fact. Tee hee"
1,The current leading bid is 151. To pause this auction send OUT. Customer Care: 08718726270
0,Good night my dear.. Sleepwell&amp;Take care
1,You won't believe it but it's true. It's Incredible Txts! Reply G now to learn truly amazing things that will blow your mind. From O2FWD only 18p/txt
0,Yeah right! I'll bring my tape measure fri!
0,Ü wait 4 me in sch i finish ard 5..
1,18 days to Euro2004 kickoff! U will be kept informed of all the latest news and results daily. Unsubscribe send GET EURO STOP to 83222.
0,Btw regarding that we should really try to see if anyone else can be our 4th guy before we commit to a random dude
1,You are being ripped off! Get your mobile content from www.clubmoby.com call 08717509990 poly/true/Pix/Ringtones/Games six downloads for only 3
1,You are awarded a SiPix Digital Camera! call 09061221061 from landline. Delivery within 28days. T Cs Box177. M221BP. 2yr warranty. 150ppm. 16 . p p£3.99
1,CALL 09090900040 & LISTEN TO EXTREME DIRTY LIVE CHAT GOING ON IN THE OFFICE RIGHT NOW TOTAL PRIVACY NO ONE KNOWS YOUR [sic] LISTENING 60P MIN 24/7MP 0870753331018+
1,HMV BONUS SPECIAL 500 pounds of genuine HMV vouchers to be won. Just answer 4 easy questions. Play Now! Send HMV to 86688 More info:www.100percent-real.com
0,"Cant believe i said so many things to you this morning when all i really wanted to say was good morning, i love you! Have a beautiful morning. See you in the library later."
1,"Latest Nokia Mobile or iPOD MP3 Player +£400 proze GUARANTEED! Reply with: WIN to 83355 now! Norcorp Ltd.£1,50/Mtmsgrcvd18+"
1,"Download as many ringtones as u like no restrictions, 1000s 2 choose. U can even send 2 yr buddys. Txt Sir to 80082 £3 "
1,"Someone U know has asked our dating service 2 contact you! Cant guess who? CALL 09058095107 NOW all will be revealed. POBox 7, S3XY 150p "
1,Block Breaker now comes in deluxe format with new features and great graphics from T-Mobile. Buy for just £5 by replying GET BBDELUXE and take the challenge
1,Hi 07734396839 IBH Customer Loyalty Offer: The NEW NOKIA6600 Mobile from ONLY £10 at TXTAUCTION!Txt word:START to No:81151 & get Yours Now!4T&
0,Let me know how it changes in the next 6hrs. It can even be appendix but you are out of that age range. However its not impossible. So just chill and let me know in 6hrs
0,"It doesnt make sense to take it there unless its free. If you need to know more, wikipedia.com"
0,Hi.what you think about match?
0,Shb b ok lor... Thanx...
0,I like to talk pa but am not able to. I dont know y.
0,I am going to sao mu today. Will be done only at 12 
0,Thanks a lot for your wishes on my birthday. Thanks you for making my birthday truly memorable.
0,"True. It is passable. And if you get a high score and apply for phd, you get 5years of salary. So it makes life easier."
0,"My painful personal thought- ""I always try to keep everybody happy all the time. But nobody recognises me when i am alone"""
1,"Sunshine Hols. To claim ur med holiday send a stamped self address envelope to Drinks on Us UK, PO Box 113, Bray, Wicklow, Eire. Quiz Starts Saturday! Unsub Stop"
1,"Double Mins & 1000 txts on Orange tariffs. Latest Motorola, SonyEricsson & Nokia with Bluetooth FREE! Call MobileUpd8 on 08000839402 or call2optout/HF8"
0,We have all rounder:)so not required:)
0,Don't necessarily expect it to be done before you get back though because I'm just now headin out
1,RCT' THNQ Adrian for U text. Rgds Vatian
0,"Yeah there's barely enough room for the two of us, x has too many fucking shoes. Sorry man, see you later"
1,goldviking (29/M) is inviting you to be his friend. Reply YES-762 or NO-762 See him: www.SMS.ac/u/goldviking STOP? Send STOP FRND to 62468
0,It has everything to do with the weather. Keep extra warm. Its a cold but nothing serious. Pls lots of vitamin c
1,"Customer service announcement. We recently tried to make a delivery to you but were unable to do so, please call 07090298926 to re-schedule. Ref:9307622"
0,Man this bus is so so so slow. I think you're gonna get there before me
0,In xam hall boy asked girl Tell me the starting term for dis answer I can den manage on my own After lot of hesitation n lookin around silently she said THE! intha ponnungale ipaditan;)
0,Is xy going 4 e lunch?
0,"Beautiful Truth against Gravity.. Read carefully: ""Our heart feels light when someone is in it.. But it feels very heavy when someone leaves it.."" GOODMORNING"
0,Sorry sent blank msg again. Yup but trying 2 do some serious studying now.
0,Amazing : If you rearrange these letters it gives the same meaning... Dormitory = Dirty room Astronomer = Moon starer The eyes = They see Election results = Lies lets recount Mother-in-law = Woman Hitler Eleven plus two =Twelve plus one Its Amazing... !:-)
1,"Congrats! 2 mobile 3G Videophones R yours. call 09061744553 now! videochat wid ur mates, play java games, Dload polyH music, noline rentl. bx420. ip4. 5we. 150pm"
0,ME 2 BABE I FEEL THE SAME LETS JUST 4GET ABOUT IT+BOTH TRY +CHEER UP+NOT FIT SOO MUCHXXLOVE U LOCAXX
1,FREE for 1st week! No1 Nokia tone 4 ur mobile every week just txt NOKIA to 8077 Get txting and tell ur mates. www.getzed.co.uk POBox 36504 W45WQ 16+ norm150p/tone
1,PRIVATE! Your 2003 Account Statement for shows 800 un-redeemed S.I.M. points. Call 08718738001 Identifier Code: 49557 Expires 26/11/04
0,"K, can that happen tonight?"
0,"Edison has rightly said, ""A fool can ask more questions than a wise man can answer"" Now you know why all of us are speechless during ViVa.. GM,GN,GE,GNT:-)"
1,Back 2 work 2morro half term over! Can U C me 2nite 4 some sexy passion B4 I have 2 go back? Chat NOW 09099726481 Luv DENA Calls £1/minMobsmoreLKPOBOX177HP51FL
0,The bus leaves at  &lt;#&gt; 
0,Yup i thk cine is better cos no need 2 go down 2 plaza mah.
1,Dear Voucher Holder 2 claim your 1st class airport lounge passes when using Your holiday voucher call 08704439680. When booking quote 1st class x 2
1,Can U get 2 phone NOW? I wanna chat 2 set up meet Call me NOW on 09096102316 U can cum here 2moro Luv JANE xx Calls£1/minmoremobsEMSPOBox45PO139WA
1,ringtoneking 84484
1,Had your mobile 11mths ? Update for FREE to Oranges latest colour camera mobiles & unlimited weekend calls. Call Mobile Upd8 on freefone 08000839402 or 2StopTx
0,They just talking thats it de. They wont any other.
0,Sorry completely forgot * will pop em round this week if your still here?
0, &lt;#&gt;  mins but i had to stop somewhere first.
0,"Night has ended for another day, morning has come in a special way. May you smile like the sunny rays and leaves your worries at the blue blue bay. Gud mrng"
1,"ou are guaranteed the latest Nokia Phone, a 40GB iPod MP3 player or a £500 prize! Txt word: COLLECT to No: 83355! IBHltd LdnW15H 150p/Mtmsgrcvd18"
1,Join the UK's horniest Dogging service and u can have sex 2nite!. Just sign up and follow the instructions. Txt ENTRY to 69888 now! Nyt.EC2A.3LP.msg@150p
1,"Welcome to UK-mobile-date this msg is FREE giving you free calling to 08719839835. Future mgs billed at 150p daily. To cancel send ""go stop"" to 89123"
0,Yar but they say got some error.
0,I dont have any of your file in my bag..i was in work when you called me.i 'll tell you if i find anything in my room.
1,Ur cash-balance is currently 500 pounds - to maximize ur cash-in now send COLLECT to 83600 only 150p/msg. CC: 08718720201 PO BOX 114/14 TCR/W1
0,Oi when you gonna ring
0,Haha... Yup hopefully  we will lose a few kg by mon. after hip hop can go orchard and weigh again
0,U studying in sch or going home? Anyway i'll b going 2 sch later.
0,Okie...
1,You have WON a guaranteed £1000 cash or a £2000 prize. To claim yr prize call our customer service representative on 08714712379 between 10am-7pm Cost 10p
0,"sorry, no, have got few things to do. may be in pub later."
0,If I get there before you after your ten billion calls and texts so help me god
1,Update_Now - 12Mths Half Price Orange line rental: 400mins...Call MobileUpd8 on 08000839402 or call2optout=J5Q
1,"all the lastest from Stereophonics, Marley, Dizzee Racal, Libertines and The Strokes! Win Nookii games with Flirt!! Click TheMob WAP Bookmark or text WAP to 82468"
1,You have won a Nokia 7250i. This is what you get when you win our FREE auction. To take part send Nokia to 86021 now. HG/Suite342/2Lands Row/W1JHL 16+
1,Congratulations U can claim 2 VIP row A Tickets 2 C Blu in concert in November or Blu gift guaranteed Call 09061104276 to claim TS&Cs www.smsco.net cost£3.75max 
1,URGENT This is our 2nd attempt to contact U. Your £900 prize from YESTERDAY is still awaiting collection. To claim CALL NOW 09061702893
1,"SMS SERVICES. for your inclusive text credits, pls goto www.comuk.net login= 3qxj9 unsubscribe with STOP, no extra charge. help 08702840625.COMUK. 220-CM2 9AE"
0,Nothing lor... A bit bored too... Then y dun u go home early 2 sleep today...
0,"Hm good morning, headache anyone? :-)"
0,Minimum walk is 3miles a day.
1,08714712388 between 10am-7pm Cost 10p
1,For taking part in our mobile survey yesterday! You can now have 500 texts 2 use however you wish. 2 get txts just send TXT to 80160 T&C www.txt43.com 1.50p
0,Ya it came a while ago
0,K k:) sms chat with me.
1,You are a winner U have been specially selected 2 receive £1000 or a 4* holiday (flights inc) speak to a live operator 2 claim 0871277810910p/min (18+) 
0,Bull. Your plan was to go floating off to IKEA with me without a care in the world. So i have to live with your mess another day.
0,What do u want when i come back?.a beautiful necklace as a token of my heart for you.thats what i will give but ONLY to MY WIFE OF MY LIKING.BE THAT AND SEE..NO ONE can give you that.dont call me.i will wait till i come.
1,Freemsg: 1-month unlimited free calls! Activate SmartCall Txt: CALL to No: 68866. Subscriptn3gbp/wk unlimited calls Help: 08448714184 Stop?txt stop landlineonly
1,URGENT This is our 2nd attempt to contact U. Your £900 prize from YESTERDAY is still awaiting collection. To claim CALL NOW 09061702893. ACL03530150PM
1,Dear U've been invited to XCHAT. This is our final attempt to contact u! Txt CHAT to 86688 150p/MsgrcvdHG/Suite342/2Lands/Row/W1J6HL LDN 18 yrs
0,Send me yetty's number pls.
1,This message is free. Welcome to the new & improved Sex & Dogging club! To unsubscribe from this service reply STOP. msgs@150p 18 only
1,Want explicit SEX in 30 secs? Ring 02073162414 now! Costs 20p/min Gsex POBOX 2667 WC1N 3XX
