Label,Text
1,URGENT! Your Mobile number has been awarded with a £2000 prize GUARANTEED. Call 09061790121 from land line. Claim 3030. Valid 12hrs only 150ppm
0,"I'm in solihull, | do you want anything?"
1,Reply to win £100 weekly! Where will the 2006 FIFA World Cup be held? Send STOP to 87239 to end service
0,Just wait till end of march when el nino gets himself. Oh.
0,Of cos can lar i'm not so ba dao ok... 1 pm lor... Y u never ask where we go ah... I said u would ask on fri but he said u will ask today...
1,EASTENDERS TV Quiz. What FLOWER does DOT compare herself to? D= VIOLET E= TULIP F= LILY txt D E or F to 84025 NOW 4 chance 2 WIN £100 Cash WKENT/150P16+
0,Do u konw waht is rael FRIENDSHIP Im gving yuo an exmpel: Jsut ese tihs msg.. Evrey splleing of tihs msg is wrnog.. Bt sitll yuo can raed it wihtuot ayn mitsake.. GOODNIGHT &amp; HAVE A NICE SLEEP..SWEET DREAMS..
1,"UpgrdCentre Orange customer, you may now claim your FREE CAMERA PHONE upgrade for your loyalty. Call now on 0207 153 9153. Offer ends 26th July. T&C's apply. Opt-out available"
0,I'll probably be around mu a lot
0,"Wen ur lovable bcums angry wid u, dnt take it seriously.. Coz being angry is d most childish n true way of showing deep affection, care n luv!.. kettoda manda... Have nice day da."
1,RGENT! This is the 2nd attempt to contact U!U have WON £1250 CALL 09071512433 b4 050703 T&CsBCM4235WC1N3XX. callcost 150ppm mobilesvary. max£7. 50
1,U have a Secret Admirer who is looking 2 make contact with U-find out who they R*reveal who thinks UR so special-call on 09065171142-stopsms-08
1,Your B4U voucher w/c 27/03 is MARSMS. Log onto www.B4Utele.com for discount credit. To opt out reply stop. Customer care call 08717168528
1,XMAS iscoming & ur awarded either £500 CD gift vouchers & free entry 2 r £100 weekly draw txt MUSIC to 87066 TnC www.Ldew.com1win150ppmx3age16subscription 
0,Tell them u have a headache and just want to use 1 hour of sick time.
0,How is your schedule next week? I am out of town this weekend.
1,LORD OF THE RINGS:RETURN OF THE KING in store NOW!REPLY LOTR by 2 June 4 Chance 2 WIN LOTR soundtrack CDs StdTxtRate. Reply STOP to end txts
0,So there's a ring that comes with the guys costumes. It's there so they can gift their future yowifes. Hint hint
1,Am new 2 club & dont fink we met yet Will B gr8 2 C U Please leave msg 2day wiv ur area 09099726553 reply promised CARLIE x Calls£1/minMobsmore LKPOBOX177HP51FL
0,I'm thinking that chennai forgot to come for auction..
0,Dont you have message offer
1,Hard LIVE 121 chat just 60p/min. Choose your girl and connect LIVE. Call 09094646899 now! Cheap Chat UK's biggest live service. VU BCM1896WC1N3XX
0,Then wat r u doing now? Busy wif work?
0,Ha ha ha good joke. Girls are situation seekers.
0,Its a valentine game. . . send dis msg to all ur friends. . If 5 answers r d same then someone really loves u. . Ques- which colour suits me the best?
0,Baaaaabe! I misss youuuuu ! Where are you ? I have to go and teach my class at 5 ...
0,HELLO PEACH! MY CAKE TASTS LUSH!
1,"FREE RING TONE just text ""POLYS"" to 87131. Then every week get a new tone. 0870737910216yrs only £1.50/wk."
0,"Nothing much, chillin at home. Any super bowl plan?"
0,Doing project w frens lor. 
1,Your unique user ID is 1172. For removal send STOP to 87239 customer services 08708034412
1,"Final Chance! Claim ur £150 worth of discount vouchers today! Text YES to 85023 now! SavaMob, member offers mobile! T Cs SavaMob POBOX84, M263UZ. £3.00 Subs 16"
1,Our brand new mobile music service is now live. The free music player will arrive shortly. Just install on your phone to browse content from the top artists.
0,I wan but too early lei... Me outside now wun b home so early... Neva mind then...
0,"Aight, lemme know what's up"
0,No let me do the math. Your not good at it.
1,Someone U know has asked our dating service 2 contact you! Cant Guess who? CALL 09058091854 NOW all will be revealed. PO BOX385 M6 6WU
1,"U were outbid by simonwatson5120 on the Shinco DVD Plyr. 2 bid again, visit sms. ac/smsrewards 2 end bid notifications, reply END OUT"
1,"SMS SERVICES. for your inclusive text credits, pls goto www.comuk.net login= 3qxj9 unsubscribe with STOP, no extra charge. help 08702840625.COMUK. 220-CM2 9AE"
0,I cant pick the phone right now. Pls send a message
1,"Urgent! Please call 0906346330. Your ABTA complimentary 4* Spanish Holiday or £10,000 cash await collection SAE T&Cs BOX 47 PO19 2EZ 150ppm 18+"
1,"You are a £1000 winner or Guaranteed Caller Prize, this is our Final attempt to contact you! To Claim Call 09071517866 Now! 150ppmPOBox10183BhamB64XE"
0,Can't take any major roles in community outreach. You rock mel
0,But I'm on a diet. And I ate 1 too many slices of pizza yesterday. Ugh I'm ALWAYS on a diet.
0,You should change your fb to jaykwon thuglyfe falconerf
1,Free Top ringtone -sub to weekly ringtone-get 1st week free-send SUBPOLY to 81618-?3 per week-stop sms-08718727870
0,Ok. C u then.
0,Ha! I wouldn't say that I just didn't read anything into way u seemed. I don't like 2 be judgemental....i save that for fridays in the pub!
0,Friendship poem: Dear O Dear U R Not Near But I Can Hear Dont Get Fear Live With Cheer No More Tear U R Always my Dear. Gud ni8
1,Had your mobile 10 mths? Update to latest Orange camera/video phones for FREE. Save £s with Free texts/weekend calls. Text YES for a callback orno to opt out
0,"Dear relieved of westonzoyland, all going to plan this end too!"
0,Sian... Aft meeting supervisor got work 2 do liao... U working now?
1,"Sppok up ur mob with a Halloween collection of nokia logo&pic message plus a FREE eerie tone, txt CARD SPOOK to 8007"
1,Please CALL 08712402902 immediately as there is an urgent message waiting for you.
0,It should take about  &lt;#&gt;  min
0,I am in bus on the way to calicut
1,"Dear Voucher Holder, 2 claim this weeks offer, at your PC go to http://www.e-tlp.co.uk/expressoffer Ts&Cs apply.2 stop texts txt STOP to 80062."
0,Have you heard from this week?
1,This message is brought to you by GMW Ltd. and is not connected to the
0,Yes its possible but dint try. Pls dont tell to any one k
0,yay! finally lol. i missed our cinema trip last week :-(
0,We don call like  &lt;#&gt;  times oh. No give us hypertension oh.
1,LIFE has never been this much fun and great until you came in. You made it truly special for me. I won't forget you! enjoy @ one gbp/sms
1,"YOUR CHANCE TO BE ON A REALITY FANTASY SHOW call now = 08707509020 Just 20p per min NTT Ltd, PO Box 1327 Croydon CR9 5WB 0870 is a national = rate call"
1,"Dear Matthew please call 09063440451 from a landline, your complimentary 4*Lux Tenerife holiday or £1000 CASH await collection. ppm150 SAE T&Cs Box334 SK38XH."
1,"Call 09094100151 to use ur mins! Calls cast 10p/min (mob vary). Service provided by AOM, just GBP5/month. AOM Box61,M60 1ER until u stop. Ages 18+ only!"
0,U gd lor go shopping i got stuff to do. U wan 2 watch infernal affairs a not? Come lar...
0,Mm so you asked me not to call radio
1,from www.Applausestore.com MonthlySubscription@50p/msg max6/month T&CsC web age16 2stop txt stop
0,Ha ha - had popped down to the loo when you hello-ed me. Hello!
0,yes baby! I need to stretch open your pussy!
1,Dear U've been invited to XCHAT. This is our final attempt to contact u! Txt CHAT to 86688
0,"V-aluable. A-ffectionate. L-oveable. E-ternal. N-oble. T-ruthful. I-ntimate. N-atural. E-namous. Happy ""VALENTINES DAY"" in advance"
1,RT-KIng Pro Video Club>> Need help? info@ringtoneking.co.uk or call 08701237397 You must be 16+ Club credits redeemable at www.ringtoneking.co.uk! Enjoy!
1,Double your mins & txts on Orange or 1/2 price linerental - Motorola and SonyEricsson with B/Tooth FREE-Nokia FREE Call MobileUpd8 on 08000839402 or2optout/HV9D
0,Yeah no probs - last night is obviously catching up with you... Speak soon 
1,Want 2 get laid tonight? Want real Dogging locations sent direct 2 ur mob? Join the UK's largest Dogging Network bt Txting GRAVEL to 69888! Nt. ec2a. 31p.msg@150p
0,"So anyways, you can just go to your gym or whatever, my love *smiles* I hope your ok and having a good day babe ... I miss you so much already"
1,We tried to contact you re our offer of New Video Phone 750 anytime any network mins HALF PRICE Rental camcorder call 08000930705 or reply for delivery Wed
1,"This is the 2nd attempt to contract U, you have won this weeks top prize of either £1000 cash or £200 prize. Just call 09066361921"
1,Todays Voda numbers ending 5226 are selected to receive a ?350 award. If you hava a match please call 08712300220 quoting claim code 1131 standard rates app 
0,"Sorry vikky, i'm Watching olave mandara movie kano in trishul theatre wit my frnds.."
1,FREE for 1st week! No1 Nokia tone 4 ur mobile every week just txt NOKIA to 8077 Get txting and tell ur mates. www.getzed.co.uk POBox 36504 W45WQ 16+ norm150p/tone
1,"Got what it takes 2 take part in the WRC Rally in Oz? U can with Lucozade Energy! Text RALLY LE to 61200 (25p), see packs or lucozade.co.uk/wrc & itcould be u!"
1,"U can WIN £100 of Music Gift Vouchers every week starting NOW Txt the word DRAW to 87066 TsCs www.Idew.com SkillGame, 1Winaweek, age16. 150ppermessSubscription"
0,either way works for me. I am  &lt;#&gt;  years old. Hope that doesnt bother you.
0,"Dear, take care. I am just reaching home.love u a lot."
1,Great NEW Offer - DOUBLE Mins & DOUBLE Txt on best Orange tariffs AND get latest camera phones 4 FREE! Call MobileUpd8 free on 08000839402 NOW! or 2stoptxt T&Cs
0,Thanks honey. Have a great day.
1,"Get 3 Lions England tone, reply lionm 4 mono or lionp 4 poly. 4 more go 2 www.ringtones.co.uk, the original n best. Tones 3GBP network operator rates apply"
1,1000's of girls many local 2 u who r virgins 2 this & r ready 2 4fil ur every sexual need. Can u 4fil theirs? text CUTE to 69911(£1.50p. m)
0,Can ü call me at 10:10 to make sure dat i've woken up...
0,"She is our sister.. She belongs 2 our family.. She is d hope of tomorrow.. Pray 4 her,who was fated 4 d Shoranur train incident. Lets hold our hands together &amp; fuelled by love &amp; concern prior 2 her grief &amp; pain. Pls join in dis chain &amp; pass it. STOP VIOLENCE AGAINST WOMEN."
1,Please call our customer service representative on FREEPHONE 0808 145 4742 between 9am-11pm as you have WON a guaranteed £1000 cash or £5000 prize!
1,"WIN: We have a winner! Mr. T. Foley won an iPod! More exciting prizes soon, so keep an eye on ur mobile or visit www.win-82050.co.uk"
0,"I'm an actor. When i work, i work in the evening and sleep late. Since i'm unemployed at the moment, i ALWAYS sleep late. When you're unemployed, every day is saturday."
0,I'm really not up to it still tonight babe
0,Yes I posted a couple of pics on fb. There's still snow outside too. I'm just waking up :)
1,Santa calling! Would your little ones like a call from Santa Xmas Eve? Call 09077818151 to book you time. Calls1.50ppm last 3mins 30s T&C www.santacalling.com
0,Fwiw the reason I'm only around when it's time to smoke is that because of gas I can only afford to be around when someone tells me to be and that apparently only happens when somebody wants to light up
1,Text BANNEDUK to 89555 to see! cost 150p textoperator g696ga 18+ XXX
0,NOT ENUFCREDEIT TOCALL.SHALL ILEAVE UNI AT 6 +GET A BUS TO YOR HOUSE?
1,Check Out Choose Your Babe Videos @ sms.shsex.netUN fgkslpoPW fgkslpo
0,"alright, I'll make sure the car is back tonight"
1,You have 1 new message. Please call 08715205273
1,Sunshine Quiz Wkly Q! Win a top Sony DVD player if u know which country Liverpool played in mid week? Txt ansr to 82277. £1.50 SP:Tyrone
0,Dont hesitate. You know this is the second time she has had weakness like that. So keep i notebook of what she eat and did the day before or if anything changed the day before so that we can be sure its nothing
0,"Hi Jon, Pete here, Ive bin 2 Spain recently & hav sum dinero left, Bill said u or ur rents mayb interested in it, I hav 12,000pes, so around £48, tb, James."
0,My sis is catching e show in e afternoon so i'm not watching w her. So c u wan 2 watch today or tmr lor.
0,"Poyyarikatur,kolathupalayam,unjalur post,erode dis, &lt;#&gt; ."
0,Wylie update: my weed dealer carlos went to freedom and had a class with lunsford
0,You in your room? I need a few
1,No. 1 Nokia Tone 4 ur mob every week! Just txt NOK to 87021. 1st Tone FREE ! so get txtin now and tell ur friends. 150p/tone. 16 reply HL 4info
1,Ur TONEXS subscription has been renewed and you have been charged £4.50. You can choose 10 more polys this month. www.clubzed.co.uk *BILLING MSG*
0,Gibbs unsold.mike hussey
1,"This is the 2nd time we have tried to contact u. U have won the £400 prize. 2 claim is easy, just call 087104711148 NOW! Only 10p per minute. BT-national-rate"
1,"Spook up your mob with a Halloween collection of a logo & pic message plus a free eerie tone, txt CARD SPOOK to 8007 zed 08701417012150p per logo/pic "
0,Where r we meeting?
0,"Height of Confidence: All the Aeronautics professors wer calld &amp; they wer askd 2 sit in an aeroplane. Aftr they sat they wer told dat the plane ws made by their students. Dey all hurried out of d plane.. Bt only 1 didnt move... He said:""if it is made by my students,this wont even start........ Datz confidence.."
1,A £400 XMAS REWARD IS WAITING FOR YOU! Our computer has randomly picked you from our loyal mobile customers to receive a £400 reward. Just call 09066380611 
0,Ard 6 like dat lor.
0,There is no sense in my foot and penis.
1,"Text82228>> Get more ringtones, logos and games from www.txt82228.com. Questions: info@txt82228.co.uk"
0,Lol. Well quality aint bad at all so i aint complaining
1,"Hi babe its Chloe, how r u? I was smashed on saturday night, it was great! How was your weekend? U been missing me? SP visionsms.com Text stop to stop 150p/text"
0,Darren was saying dat if u meeting da ge den we dun meet 4 dinner. Cos later u leave xy will feel awkward. Den u meet him 4 lunch lor.
0,"Hello! Just got here, st andrews-boy its a long way! Its cold. I will keep you posted"
0,Great! I hope you like your man well endowed. I am  &lt;#&gt;  inches...
1,"Get 3 Lions England tone, reply lionm 4 mono or lionp 4 poly. 4 more go 2 www.ringtones.co.uk, the original n best. Tones 3GBP network operator rates apply."
0,I'm not driving... Raining! Then i'll get caught at e mrt station lor.
1,You are a winner U have been specially selected 2 receive £1000 cash or a 4* holiday (flights inc) speak to a live operator 2 claim 0871277810810
1,Not heard from U4 a while. Call me now am here all night with just my knickers on. Make me beg for it like U did last time 01223585236 XX Luv Nikiyu4.net
1,Congratulations ur awarded either £500 of CD gift vouchers & Free entry 2 our £100 weekly draw txt MUSIC to 87066 TnCs www.Ldew.com1win150ppmx3age16
1,TheMob>Yo yo yo-Here comes a new selection of hot downloads for our members to get for FREE! Just click & open the next link sent to ur fone...
1,PRIVATE! Your 2003 Account Statement for 07808247860 shows 800 un-redeemed S. I. M. points. Call 08719899229 Identifier Code: 40411 Expires 06/11/04
0,I attended but nothing is there.
1,GSOH? Good with SPAM the ladies?U could b a male gigolo? 2 join the uk's fastest growing mens club reply ONCALL. mjzgroup. 08714342399.2stop reply STOP. msg@£1.50rcvd
0,"Oh right, ok. I'll make sure that i do loads of work during the day!  got a really nasty cough today and is dry n shot so that should really help it!"
1,"HOT LIVE FANTASIES call now 08707509020 Just 20p per min NTT Ltd, PO Box 1327 Croydon CR9 5WB 0870 is a national rate call"
0,Hmmm.but you should give it on one day..
1,U 447801259231 have a secret admirer who is looking 2 make contact with U-find out who they R*reveal who thinks UR so special-call on 09058094597
1,it to 80488. Your 500 free text messages are valid until 31 December 2005.
0,Did u fix the teeth?if not do it asap.ok take care.
1,WINNER!! As a valued network customer you have been selected to receivea £900 prize reward! To claim call 09061701461. Claim code KL341. Valid 12 hours only.
1,Marvel Mobile Play the official Ultimate Spider-man game (£4.50) on ur mobile right now. Text SPIDER to 83338 for the game & we ll send u a FREE 8Ball wallpaper
1,URGENT! We are trying to contact U. Todays draw shows that you have won a £800 prize GUARANTEED. Call 09050003091 from land line. Claim C52. Valid 12hrs only
0,Have you bookedthe hut? And also your time off? How are you by the way?
1,sexy sexy cum and text me im wet and warm and ready for some porn! u up for some fun? THIS MSG IS FREE RECD MSGS 150P INC VAT 2 CANCEL TEXT STOP
0,Mm you ask him to come its enough :-)
1,U are subscribed to the best Mobile Content Service in the UK for £3 per ten days until you send STOP to 83435. Helpline 08706091795.
1,Do you want 750 anytime any network mins 150 text and a NEW video phone for only five pounds per week call 08000776320 now or reply for delivery Tomorrow
0,Or remind me in a few hrs.
0,Then why you not responding
1,ROMCAPspam Everyone around should be responding well to your presence since you are so warm and outgoing. You are bringing in a real breath of sunshine.
1,Call FREEPHONE 0800 542 0578 now!
1,FreeMsg: Fancy a flirt? Reply DATE now & join the UKs fastest growing mobile dating service. Msgs rcvd just 25p to optout txt stop to 83021. Reply DATE now!
1,You can donate £2.50 to UNICEF's Asian Tsunami disaster support fund by texting DONATE to 864233. £2.50 will be added to your next bill
0,"Goodmorning, today i am late for 1hr."
0,Did u find a sitter for kaitlyn? I was sick and slept all day yesterday.
1,FREE MSG:We billed your mobile number by mistake from shortcode 83332.Please call 08081263000 to have charges refunded.This call will be free from a BT landline
0,Do u noe how 2 send files between 2 computers?
1,"URGENT! Your mobile No *********** WON a £2,000 Bonus Caller Prize on 02/06/03! This is the 2nd attempt to reach YOU! Call 09066362220 ASAP! BOX97N7QP, 150ppm"
0,Am on a train back from northampton so i'm afraid not! I'm staying skyving off today ho ho! Will be around wednesday though. Do you fancy the comedy club this week by the way?
1,YOU HAVE WON! As a valued Vodafone customer our computer has picked YOU to win a £150 prize. To collect is easy. Just call 09061743386
1,Want a new Video Phone? 750 anytime any network mins? Half price line rental free text for 3 months? Reply or call 08000930705 for free delivery
0,They have a thread on the wishlist section of the forums where ppl post nitro requests. Start from the last page and collect from the bottom up.
0,Cheers for the message Zogtorius. Ive been staring at my phone for an age deciding whether to text or not.
0,"Wen u miss someone, the person is definitely special for u..... But if the person is so special, why to miss them, just Keep-in-touch gdeve.."
1,okmail: Dear Dave this is your final notice to collect your 4* Tenerife Holiday or #5000 CASH award! Call 09061743806 from landline. TCs SAE Box326 CW25WX 150ppm
1,Customer Loyalty Offer:The NEW Nokia6650 Mobile from ONLY £10 at TXTAUCTION! Txt word: START to No: 81151 & get yours Now! 4T&Ctxt TC 150p/MTmsg
1,"1000's flirting NOW! Txt GIRL or BLOKE & ur NAME & AGE, eg GIRL ZOE 18 to 8007 to join and get chatting!"
0,"Greetings me, ! Consider yourself excused."
1,U have a secret admirer. REVEAL who thinks U R So special. Call 09065174042. To opt out Reply REVEAL STOP. 1.50 per msg recd. Cust care 07821230901
0,Ahhh. Work. I vaguely remember that! What does it feel like? Lol
1,Please call our customer service representative on FREEPHONE 0808 145 4742 between 9am-11pm as you have WON a guaranteed £1000 cash or £5000 prize!
0,Thanx but my birthday is over already.
1,"In The Simpsons Movie released in July 2007 name the band that died at the start of the film? A-Green Day, B-Blue Day, C-Red Day. (Send A, B or C)"
1,"Today's Offer! Claim ur £150 worth of discount vouchers! Text YES to 85023 now! SavaMob, member offers mobile! T Cs 08717898035. £3.00 Sub. 16 . Unsub reply X"
0,Jordan got voted out last nite!
1,URGENT! Your Mobile number has been awarded with a £2000 Bonus Caller Prize. Call 09058095201 from land line. Valid 12hrs only
0,But you dint in touch with me.
1,UR GOING 2 BAHAMAS! CallFREEFONE 08081560665 and speak to a live operator to claim either Bahamas cruise of£2000 CASH 18+only. To opt out txt X to 07786200117
0,For The First Time In The History 'Need' 'Comfort' And 'Luxury' Are Sold At Same Price In India..!! Onion-Rs. &lt;#&gt;  Petrol-Rs. &lt;#&gt;  Beer-Rs. &lt;#&gt;  SHESIL  &lt;#&gt;
1,You have won a guaranteed £200 award or even £1000 cashto claim UR award call free on 08000407165 (18+) 2 stop getstop on 88222 PHP
0,Im done. Just studyn in library
0,"sir, you will receive the account no another 1hr time. Sorry for the delay."
0,Are u coming to the funeral home
0,Yes princess! I want to make you happy...
1,How about getting in touch with folks waiting for company? Just txt back your NAME and AGE to opt in! Enjoy the community (150p/SMS)
1,"You have won ?1,000 cash or a ?2,000 prize! To claim, call09050000327"
1,"This is the 2nd time we have tried 2 contact u. U have won the 750 Pound prize. 2 claim is easy, call 08712101358 NOW! Only 10p per min. BT-national-rate"
0,Yar i wanted 2 scold u yest but late already... I where got zhong se qing you? If u ask me b4 he ask me then i'll go out w u all lor. N u still can act so real.
1,Free video camera phones with Half Price line rental for 12 mths and 500 cross ntwk mins 100 txts. Call MobileUpd8 08001950382 or Call2OptOut/674&
0,Future is not what we planned for tomorrow.....! it is the result of what we do today...! Do the best in present... enjoy the future.
0,Lol I know! They're so dramatic. Schools already closed for tomorrow. Apparently we can't drive in the inch of snow were supposed to get.
1,U have a secret admirer who is looking 2 make contact with U-find out who they R*reveal who thinks UR so special-call on 09058094599
1,FREE for 1st week! No1 Nokia tone 4 ur mob every week just txt NOKIA to 87077 Get txting and tell ur mates. zed POBox 36504 W45WQ norm150p/tone 16+
1,"HOT LIVE FANTASIES call now 08707509020 Just 20p per min NTT Ltd, PO Box 1327 Croydon CR9 5WB 0870..k"
0,Hi its in durban are you still on this number
0,"CAN I PLEASE COME UP NOW IMIN TOWN.DONTMATTER IF URGOIN OUTL8R,JUST REALLYNEED 2DOCD.PLEASE DONTPLEASE DONTIGNORE MYCALLS,U NO THECD ISV.IMPORTANT TOME 4 2MORO"
0,No:-)i got rumour that you going to buy apartment in chennai:-)
1,SMS AUCTION - A BRAND NEW Nokia 7250 is up 4 auction today! Auction is FREE 2 join & take part! Txt NOKIA to 86021 now! HG/Suite342/2Lands Row/W1J6HL
0,"see you then, we're all christmassy here!"
1,"Romantic Paris. 2 nights, 2 flights from £79 Book now 4 next year. Call 08704439680Ts&Cs apply."
0,Gud ni8 dear..slp well..take care..swt dreams..Muah..
0,Haha... can... But i'm having dinner with my cousin...
1,Get your garden ready for summer with a FREE selection of summer bulbs and seeds worth £33:50 only with The Scotsman this Saturday. To stop go2 notxt.co.uk
0,Tell rob to mack his gf in the theater
1,Last chance 2 claim ur £150 worth of discount vouchers-Text YES to 85023 now!SavaMob-member offers mobile T Cs 08717898035. £3.00 Sub. 16 . Remove txt X or STOP
1,Buy Space Invaders 4 a chance 2 win orig Arcade Game console. Press 0 for Games Arcade (std WAP charge) See o2.co.uk/games 4 Terms + settings. No purchase
1,Hey I am really horny want to chat or see me naked text hot to 69698 text charged at 150pm to unsubscribe text stop 69698
0,Okay. I've seen it. So i should pick it on friday?
0,Nokia phone is lovly..
0,K:)i will give my kvb acc details:)
1,"Double mins and txts 4 6months FREE Bluetooth on Orange. Available on Sony, Nokia Motorola phones. Call MobileUpd8 on 08000839402 or call2optout/N9DX"
0,"Velly good, yes please!"
0,Hi' Test on  &lt;#&gt; rd ....
1,WIN a year supply of CDs 4 a store of ur choice worth £500 & enter our £100 Weekly draw txt MUSIC to 87066 Ts&Cs www.Ldew.com.subs16+1win150ppmx3
0,Thts wat Wright Brother did to fly..
1,"If you don't, your prize will go to another customer. T&C at www.t-c.biz 18+ 150p/min Polo Ltd Suite 373 London W1J 6HL Please call back if busy "
1,"Congrats! 2 mobile 3G Videophones R yours. call 09061744553 now! videochat wid ur mates, play java games, Dload polyH music, noline rentl. bx420. ip4. 5we. 150pm"
0,I tot u outside cos darren say u come shopping. Of course we nice wat. We jus went sim lim look at mp3 player.
1,"FREE NOKIA Or Motorola with upto 12mths 1/2price linerental, 500 FREE x-net mins&100txt/mth FREE B'tooth*. Call Mobileupd8 on 08001950382 or call 2optout/D3WV"
1,You have been specially selected to receive a 2000 pound award! Call 08712402050 BEFORE the lines close. Cost 10ppm. 16+. T&Cs apply. AG Promo
0,Then we gotta do it after that
0,"Good afternoon on this glorious anniversary day, my sweet J !! I hope this finds you happy and content, my Prey. I think of you and send a teasing kiss from across the sea coaxing images of fond souveniers ... You Cougar-Pen"
1,Thanks 4 your continued support Your question this week will enter u in2 our draw 4 £100 cash. Name the NEW US President? txt ans to 80082
0,Ok no prob
0,Omg it could snow here tonite!
0,Why are u up so early?
0,You're gonna have to be way more specific than that
0,Noooooooo please. Last thing I need is stress. For once in your life be fair.
0,Think + da. You wil do.
1,"SMS. ac JSco: Energy is high, but u may not know where 2channel it. 2day ur leadership skills r strong. Psychic? Reply ANS w/question. End? Reply END JSCO"
1,Money i have won wining number 946 wot do i do next
1,Mobile Club: Choose any of the top quality items for your mobile. 7cfca1a
0,"By march ending, i should be ready. But will call you for sure. The problem is that my capital never complete. How far with you. How's work and the ladies"
