Label,Text
1,<Forwarded from 21870000>Hi - this is your Mailbox Messaging SMS alert. You have 4 messages. You have 21 matches. Please call back on 09056242159 to retrieve your messages and matches
0,What time you coming down later? 
1,<Forwarded from 88877>FREE entry into our £250 weekly comp just send the word ENTER to 88877 NOW. 18 T&C www.textcomp.com
0,I'm wif him now buying tix lar...
0,HI DARLIN HOW WAS WORK DID U GET INTO TROUBLE? IJUST TALKED TO YOUR MUM ALL MORNING! I HAD A REALLY GOOD TIME LAST NIGHT IM GOIN OUT SOON BUT CALL ME IF U CAN
0,Do you always celebrate NY's with your family ?
0,HCL chennai requires FRESHERS for voice process.Excellent english needed.Salary upto  &lt;#&gt; .Call Ms.Suman  &lt;#&gt;  for Telephonic interview -via Indyarocks.com
1,Todays Vodafone numbers ending with 4882 are selected to a receive a £350 award. If your number matches call 09064019014 to receive your £350 award.
1,"accordingly. I repeat, just text the word ok on your mobile phone and send"
1,Boltblue tones for 150p Reply POLY# or MONO# eg POLY3 1. Cha Cha Slide 2. Yeah 3. Slow Jamz 6. Toxic 8. Come With Me or STOP 4 more tones txt MORE
0,"The world is running and i am still.maybe all are feeling the same,so be it.or i have to admit,i am mad.then where is the correction?or let me call this is life.and keep running with the world,may be u r also running.lets run."
1,"Orange brings you ringtones from all time Chart Heroes, with a free hit each week! Go to Ringtones & Pics on wap. To stop receiving these tips reply STOP."
0,"Sorry, I'll call later"
0,Leave it de:-). Start Prepare for next:-)..
0,Will do. Was exhausted on train this morning. Too much wine and pie. You sleep well too
1,URGENT! Your Mobile number has been awarded with a £2000 prize GUARANTEED. Call 09058094454 from land line. Claim 3030. Valid 12hrs only
0,Hi :)finally i completed the course:)
0,Talk With Yourself Atleast Once In A Day...!!! Otherwise You Will Miss Your Best FRIEND In This WORLD...!!! -Shakespeare- SHESIL  &lt;#&gt;
0,Umma my life and vava umma love you lot dear
0,Your daily text from me – a favour this time
1,"Hack Chat. Get backdoor entry into 121 chat rooms at a fraction of the cost. Reply NEO69 or call 09050280520, to subscribe 25p pm. DPS, Bcm box 8027 Ldn, wc1n3xx"
1,YOU ARE CHOSEN TO RECEIVE A £350 AWARD! Pls call claim number 09066364311 to collect your award which you are selected to receive as a valued mobile customer.
0,"Fuuuuck I need to stop sleepin, sup"
0,What Today-sunday..sunday is holiday..so no work..
0,Where @
1,"Thanks for your ringtone order, reference number X49.Your mobile will be charged 4.50. Should your tone not arrive please call customer services 09065989182"
1,"You are being contacted by our dating service by someone you know! To find out who it is, call from a land line 09050000878. PoBox45W2TG150P"
0,"Abeg, make profit. But its a start. Are you using it to get sponsors for the next event?"
1,Free 1st week entry 2 TEXTPOD 4 a chance 2 win 40GB iPod or £250 cash every wk. Txt POD to 84128 Ts&Cs www.textpod.net custcare 08712405020.
1,Free 1st week entry 2 TEXTPOD 4 a chance 2 win 40GB iPod or £250 cash every wk. Txt VPOD to 81303 Ts&Cs www.textpod.net custcare 08712405020.
0,Ok... I din get ur msg...
1,"You can stop further club tones by replying ""STOP MIX"" See my-tone.com/enjoy. html for terms. Club tones cost GBP4.50/week. MFL, PO Box 1146 MK45 2WT (2/3)"
1,Moby Pub Quiz.Win a £100 High Street prize if u know who the new Duchess of Cornwall will be? Txt her first name to 82277.unsub STOP £1.50 008704050406 SP Arrow
0,Your brother is a genius
0,Howz that persons story
1,"Congrats! 2 mobile 3G Videophones R yours. call 09063458130 now! videochat wid your mates, play java games, Dload polyPH music, noline rentl."
0,"Haha, my legs and neck are killing me and my amigos are hoping to end the night with a burn, think I could swing by in like an hour?"
1,FREE entry into our £250 weekly comp just send the word WIN to 80086 NOW. 18 T&C www.txttowin.co.uk
1,Get a FREE mobile video player FREE movie. To collect text GO to 89105. Its free! Extra films can be ordered t's and c's apply. 18 yrs only
1,Double Mins & Double Txt & 1/2 price Linerental on Latest Orange Bluetooth mobiles. Call MobileUpd8 for the very latest offers. 08000839402 or call2optout/LF56
0,"Wait, do you know if wesleys in town? I bet she does hella drugs!"
0,Jesus armand really is trying to tell everybody he can find
0,"YEH I AM DEF UP4 SOMETHING SAT,JUST GOT PAYED2DAY & I HAVBEEN GIVEN A£50 PAY RISE 4MY WORK & HAVEBEEN MADE PRESCHOOLCO-ORDINATOR 2I AM FEELINGOOD LUV"
0,"Each Moment in a day,has its own value-Morning brings hope,afternoon brings faith,Evening brings luv,Night brings rest,Wish u find them all today.Good Morning"
1,Ringtone Club: Gr8 new polys direct to your mobile every week !
1,"Sunshine Hols. To claim ur med holiday send a stamped self address envelope to Drinks on Us UK, PO Box 113, Bray, Wicklow, Eire. Quiz Starts Saturday! Unsub Stop"
0,Now i'm going for lunch.
0,Today my system sh get ready.all is well and i am also in the deep well
1,"HOT LIVE FANTASIES call now 08707500020 Just 20p per min NTT Ltd, PO Box 1327 Croydon CR9 5WB 0870 is a national rate call"
1,This is the 2nd time we have tried to contact u. U have won the £1450 prize to claim just call 09053750005 b4 310303. T&Cs/stop SMS 08718725756. 140ppm
0,Thinking of u ;) x
0,Stupid auto correct on my phone
0,Never y lei... I v lazy... Got wat? Dat day ü send me da url cant work one...
1,Please call our customer service representative on FREEPHONE 0808 145 4742 between 9am-11pm as you have WON a guaranteed £1000 cash or £5000 prize!
0,WHEN THE FIRST STRIKE IS A RED ONE. THE BIRD + ANTELOPE BEGIN TOPLAY IN THE FIELDOF SELFINDEPENDENCE BELIEVE THIS + THE FLOWER OF CONTENTION WILL GROW.RANDOM!
1,wamma get laid?want real doggin locations sent direct to your mobile? join the UKs largest dogging network. txt dogs to 69696 now!nyt. ec2a. 3lp £1.50/msg.
1,PRIVATE! Your 2003 Account Statement for 078
0,LOL ... Have you made plans for new years?
0,How much it will cost approx . Per month.
1,URGENT! We are trying to contact U. Todays draw shows that you have won a £800 prize GUARANTEED. Call 09050003091 from land line. Claim C52. Valid12hrs only
1,"500 New Mobiles from 2004, MUST GO! Txt: NOKIA to No: 89545 & collect yours today!From ONLY £1 www.4-tc.biz 2optout 087187262701.50gbp/mtmsg18"
1,URGENT! This is the 2nd attempt to contact U!U have WON £1000CALL 09071512432 b4 300603t&csBCM4235WC1N3XX.callcost150ppmmobilesvary. max£7. 50
0,"Mon okie lor... Haha, best is cheap n gd food la, ex oso okie... Depends on whether wana eat western or chinese food... Den which u prefer... "
1,"Ur balance is now £600. Next question: Complete the landmark, Big, A. Bob, B. Barry or C. Ben ?. Text A, B or C to 83738. Good luck!"
1,"5 Free Top Polyphonic Tones call 087018728737, National Rate. Get a toppoly tune sent every week, just text SUBPOLY to 81618, £3 per pole. UnSub 08718727870."
0,You are right. Meanwhile how's project twins comin up
1,You have won a Nokia 7250i. This is what you get when you win our FREE auction. To take part send Nokia to 86021 now. HG/Suite342/2Lands Row/W1JHL 16+
1,I don't know u and u don't know me. Send CHAT to 86688 now and let's find each other! Only 150p/Msg rcvd. HG/Suite342/2Lands/Row/W1J6HL LDN. 18 years or over.
1,"SMS. ac sun0819 posts HELLO:""You seem cool, wanted to say hi. HI!!!"" Stop? Send STOP to 62468"
0,Ü thk of wat to eat tonight.
1,"FREE GAME. Get Rayman Golf 4 FREE from the O2 Games Arcade. 1st get UR games settings. Reply POST, then save & activ8. Press 0 key for Arcade. Termsapply"
0,You all ready for * big day tomorrow?
1,sports fans - get the latest sports news str* 2 ur mobile 1 wk FREE PLUS a FREE TONE Txt SPORT ON to 8007 www.getzed.co.uk 0870141701216+ norm 4txt/120p 
0,"I'm outside islands, head towards hard rock and you'll run into me"
1,Great News! Call FREEFONE 08006344447 to claim your guaranteed £1000 CASH or £2000 gift. Speak to a live operator NOW!
0,Just send a text. We'll skype later.
0,"Beautiful Truth against Gravity.. Read carefully: ""Our heart feels light when someone is in it.. But it feels very heavy when someone leaves it.."" GOODMORNING"
1,Sunshine Quiz Wkly Q! Win a top Sony DVD player if u know which country the Algarve is in? Txt ansr to 82277. £1.50 SP:Tyrone
1,* FREE* POLYPHONIC RINGTONE Text SUPER to 87131 to get your FREE POLY TONE of the week now! 16 SN PoBox202 NR31 7ZS subscription 450pw
1,1st wk FREE! Gr8 tones str8 2 u each wk. Txt NOKIA ON to 8007 for Classic Nokia tones or HIT ON to 8007 for Polys. Nokia/150p Poly/200p 16+
1,Free tones Hope you enjoyed your new content. text stop to 61610 to unsubscribe. help:08712400602450p Provided by tones2you.co.uk
0,"New Theory: Argument wins d SITUATION, but loses the PERSON. So dont argue with ur friends just.. . . . kick them &amp; say, I'm always correct.!"
0,Where do you need to go to get it?
0,Oh ok wait 4 me there... My lect havent finish
1,URGENT! We are trying to contact U. Todays draw shows that you have won a £800 prize GUARANTEED. Call 09050001808 from land line. Claim M95. Valid12hrs only
1,IMPORTANT INFORMATION 4 ORANGE USER 0796XXXXXX. TODAY IS UR LUCKY DAY!2 FIND OUT WHY LOG ONTO http://www.urawinner.com THERE'S A FANTASTIC PRIZEAWAITING YOU!
0,I don't know but I'm raping dudes at poker
1,Buy Space Invaders 4 a chance 2 win orig Arcade Game console. Press 0 for Games Arcade (std WAP charge) See o2.co.uk/games 4 Terms + settings. No purchase
0,"Hello, yeah i've just got out of the bath and need to do my hair so i'll come up when i'm done, yeah?"
0,"I get out of class in bsn in like  &lt;#&gt;  minutes, you know where advising is?"
0,It is a good thing I'm now getting the connection to bw
1,We currently have a message awaiting your collection. To collect your message just call 08718723815.
1,"FREE2DAY sexy St George's Day pic of Jordan!Txt PIC to 89080 dont miss out, then every wk a saucy celeb!4 more pics c PocketBabe.co.uk 0870241182716 £3/wk"
0,Oic... I saw him too but i tot he din c me... I found a group liao...
0,No got new job at bar in airport on satsgettin 4.47per hour but means no lie in! keep in touch
0,I've not sent it. He can send me.
1,"Loan for any purpose £500 - £75,000. Homeowners + Tenants welcome. Have you been previously refused? We can still help. Call Free 0800 1956669 or text back 'help'"
1,Email AlertFrom: Jeri StewartSize: 2KBSubject: Low-cost prescripiton drvgsTo listen to email call 123
1,U have won a nokia 6230 plus a free digital camera. This is what u get when u win our FREE auction. To take part send NOKIA to 83383 now. POBOX114/14TCR/W1 16
0,Does she usually take fifteen fucking minutes to respond to a yes or no question
0,Audrie lousy autocorrect
1,Bored housewives! Chat n date now! 0871750.77.11! BT-national rate 10p/min only from landlines!
1,"Gr8 Poly tones 4 ALL mobs direct 2u rply with POLY TITLE to 8007 eg POLY BREATHE1 Titles: CRAZYIN, SLEEPINGWITH, FINEST, YMCA :getzed.co.uk POBox365O4W45WQ 300p"
1,Text & meet someone sexy today. U can find a date or even flirt its up to U. Join 4 just 10p. REPLY with NAME & AGE eg Sam 25. 18 -msg recd@thirtyeight pence
0,Havent planning to buy later. I check already lido only got 530 show in e afternoon. U finish work already?
0,I'm so in love with you. I'm excited each day i spend with you. You make me so happy.
1,"SPJanuary Male Sale! Hot Gay chat now cheaper, call 08709222922. National rate from 1.5p/min cheap to 7.8p/min peak! To stop texts call 08712460324 (10p/min)"
1,"Last Chance! Claim ur £150 worth of discount vouchers today! Text SHOP to 85023 now! SavaMob, offers mobile! T Cs SavaMob POBOX84, M263UZ. £3.00 Sub. 16"
0,Oh that was a forwarded message. I thought you send that to me
0,Finish liao... U?
0,"Cool, text me when you head out"
0,Is there a reason we've not spoken this year? Anyways have a great week and all the best in your exam
0,Was the farm open?
1,18 days to Euro2004 kickoff! U will be kept informed of all the latest news and results daily. Unsubscribe send GET EURO STOP to 83222.
1,"If you don't, your prize will go to another customer. T&C at www.t-c.biz 18+ 150p/min Polo Ltd Suite 373 London W1J 6HL Please call back if busy"
0,I wait 4 ü inside da car park...
1,Camera - You are awarded a SiPix Digital Camera! call 09061221066 fromm landline. Delivery within 28 days.
1,network operator. The service is free. For T & C's visit 80488.biz
1,You have an important customer service announcement. Call FREEPHONE 0800 542 0825 now!
0,Its ok my arm is feeling weak cuz i got a shot so we can go another time
0,I cant pick the phone right now. Pls send a message
1,"England v Macedonia - dont miss the goals/team news. Txt ur national team to 87077 eg ENGLAND to 87077 Try:WALES, SCOTLAND 4txt/ú1.20 POBOXox36504W45WQ 16+"
0,Also remember to get dobby's bowl from your car
0,"Yo carlos, a few friends are already asking me about you, you working at all this weekend?"
0,How have your little darlings been so far this week? Need a coffee run tomo?Can't believe it's that time of week already …
0,"Jay told me already, will do"
0,I jus reached home. I go bathe first. But my sis using net tell u when she finishes k...
1,"HOT LIVE FANTASIES call now 08707509020 Just 20p per min NTT Ltd, PO Box 1327 Croydon CR9 5WB 0870 is a national rate call"
0,Sorry i've not gone to that place. I.ll do so tomorrow. Really sorry.
0,Don't fret. I'll buy the ovulation test strips and send them to you. You wont get them til like march. Can you send me your postal address.u'll be alright.Okay.
0,I donno its in your genes or something
0,Will do. Have a good day
0,"Oh, yes, I've just been a little under the weather so i've kind of been coccooning at home"
0,Yes I know the cheesy songs from frosty the snowman :)
0,Oh my God. I'm almost home
1,Please call our customer service representative on FREEPHONE 0808 145 4742 between 9am-11pm as you have WON a guaranteed £1000 cash or £5000 prize!
0,Good morning pookie pie! Lol hope I didn't wake u up
1,"Congrats! 1 year special cinema pass for 2 is yours. call 09061209465 now! C Suprman V, Matrix3, StarWars3, etc all 4 FREE! bx420-ip4-5we. 150pm. Dont miss out!"
1,FreeMsg Hi baby wow just got a new cam moby. Wanna C a hot pic? or Fancy a chat?Im w8in 4uTxt / rply CHAT to 82242 Hlp 08712317606 Msg150p 2rcv
0,Please don't text me anymore. I have nothing else to say.
1,IMPORTANT MESSAGE. This is a final contact attempt. You have important messages waiting out our customer claims dept. Expires 13/4/04. Call 08717507382 NOW!
1,"Will u meet ur dream partner soon? Is ur career off 2 a flyng start? 2 find out free, txt HORO followed by ur star sign, e. g. HORO ARIES"
1,"Had your mobile 10 mths? Update to the latest Camera/Video phones for FREE. KEEP UR SAME NUMBER, Get extra free mins/texts. Text YES for a call"
0,Me too. Mark is taking forever to pick up my prescription and the pain is coming back.
0,I'll pick you up at about 5.15pm to go to taunton if you still want to come.
0,I know you are. Can you pls open the back?
0,Ok enjoy . R u there in home.
1,Congratulations ur awarded 500 of CD vouchers or 125gift guaranteed & Free entry 2 100 wkly draw txt MUSIC to 87066 TnCs www.Ldew.com1win150ppmx3age16
1,"Bored of speed dating? Try SPEEDCHAT, txt SPEEDCHAT to 80155, if you don't like em txt SWAP and get a new chatter! Chat80155 POBox36504W45WQ 150p/msg rcd 16"
0,"Lemme know when I can swing by and pick up, I'm free basically any time after 1 all this semester"
0,Roger that. We‘re probably going to rem in about 20
0,"Dear all, as we know  &lt;#&gt; th is the  &lt;#&gt; th birthday of our loving Gopalettan. We are planning to give a small gift on that day. Those who like to participate in that you are welcome. Please contact our admin team for more details"
1,U have a secret admirer who is looking 2 make contact with U-find out who they R*reveal who thinks UR so special-call on 09058094565
1,"SMSSERVICES. for yourinclusive text credits, pls goto www.comuk.net login= 3qxj9 unsubscribe with STOP, no extra charge. help 08702840625.COMUK. 220-CM2 9AE"
1,Bloomberg -Message center +447797706009 Why wait? Apply for your future http://careers. bloomberg.com
0,"Aight, see you in a bit"
0,"Solve d Case : A Man Was Found Murdered On  &lt;DECIMAL&gt; . &lt;#&gt;  AfterNoon. 1,His wife called Police. 2,Police questioned everyone. 3,Wife: Sir,I was sleeping, when the murder took place. 4.Cook: I was cooking. 5.Gardener: I was picking vegetables. 6.House-Maid: I went 2 d post office. 7.Children: We went 2 play. 8.Neighbour: We went 2 a marriage. Police arrested d murderer Immediately. Who's It? Reply With Reason, If U r Brilliant."
1,FREEMSG: Our records indicate you may be entitled to 3750 pounds for the Accident you had. To claim for free reply with YES to this msg. To opt out text STOP
1,This message is free. Welcome to the new & improved Sex & Dogging club! To unsubscribe from this service reply STOP. msgs@150p 18+only
1,You are a winner you have been specially selected to receive £1000 cash or a £2000 award. Speak to a live operator to claim call 087123002209am-7pm. Cost 10p
1,FREE for 1st week! No1 Nokia tone 4 ur mob every week just txt NOKIA to 8007 Get txting and tell ur mates www.getzed.co.uk POBox 36504 W45WQ norm150p/tone 16+
0,Meeting u is my work. . . Tel me when shall i do my work tomorrow
0,Fine am simply sitting.
0,"My Parents, My Kidz, My Friends n My Colleagues. All screaming.. SURPRISE !! and I was waiting on the sofa.. ... ..... ' NAKED...!"
1,"0A$NETWORKS allow companies to bill for SMS, so they are responsible for their ""suppliers"", just as a shop has to give a guarantee on what they sell. B. G."
0,Sitting ard nothing to do lor. U leh busy w work?
1,"URGENT! Your Mobile No 07808726822 was awarded a £2,000 Bonus Caller Prize on 02/09/03! This is our 2nd attempt to contact YOU! Call 0871-872-9758 BOX95QU"
1,You are a winner U have been specially selected 2 receive £1000 cash or a 4* holiday (flights inc) speak to a live operator 2 claim 0871277810810
0,"Wn u r hurt by d prsn who s close 2 u, do fight wit dem. Coz somtimes dis fight saves a relation bt being quiet leaves nothin in a relation.. Gud eveB-)"
0,Please da call me any mistake from my side sorry da. Pls da goto doctor.
1,Sex up ur mobile with a FREE sexy pic of Jordan! Just text BABE to 88600. Then every wk get a sexy celeb! PocketBabe.co.uk 4 more pics. 16 £3/wk 087016248
0,I was gonna ask you lol but i think its at 7
1,Do you want a New Nokia 3510i Colour Phone Delivered Tomorrow? With 200 FREE minutes to any mobile + 100 FREE text + FREE camcorder Reply or Call 8000930705
1,"REMINDER FROM O2: To get 2.50 pounds free call credit and details of great offers pls reply 2 this text with your valid name, house no and postcode"
1,We have new local dates in your area - Lots of new people registered in YOUR AREA. Reply DATE to start now! 18 only www.flirtparty.us REPLYS150
1,"Thanks for your ringtone order, ref number R836. Your mobile will be charged £4.50. Should your tone not arrive please call customer services on 09065069154"
1,RECPT 1/3. You have ordered a Ringtone. Your order is being processed...
0,Ok anyway no need to change with what you said
1,"U can WIN £100 of Music Gift Vouchers every week starting NOW Txt the word DRAW to 87066 TsCs www.ldew.com SkillGame,1Winaweek, age16.150ppermessSubscription"
1,PRIVATE! Your 2004 Account Statement for 078498****7 shows 786 unredeemed Bonus Points. To claim call 08719180219 Identifier Code: 45239 Expires 06.05.05
1,todays vodafone numbers ending with 0089(my last four digits) are selected to received a £350 award. If your number matches please call 09063442151 to claim your £350 award
0,Great. Never been better. Each day gives even more reasons to thank God
1,Hope you enjoyed your new content. text stop to 61610 to unsubscribe. help:08712400602450p Provided by tones2you.co.uk
0,So i could kiss and feel you next to me...
0,Hey i booked the kb on sat already... what other lessons are we going for ah? Keep your sat night free we need to meet and confirm our lodging 
0,Howz that persons story
0,Goodmorning sleeping ga.
0,"My friend just got here and says he's upping his order by a few grams (he's got $ &lt;#&gt; ), when can you get here?"
1,Free video camera phones with Half Price line rental for 12 mths and 500 cross ntwk mins 100 txts. Call MobileUpd8 08001950382 or Call2OptOut/674
1,You have 1 new voicemail. Please call 08719181513.
1,"Free entry to the gr8prizes wkly comp 4 a chance to win the latest Nokia 8800, PSP or £250 cash every wk.TXT GREAT to 80878 http//www.gr8prizes.com 08715705022"
0,This is ur face test ( 1 2 3 4 5 6 7 8 9  &lt;#&gt;  ) select any number i will tell ur face astrology.... am waiting. quick reply...
0,Ooooooh I forgot to tell u I can get on yoville on my phone
0,Congratulations ore mo owo re wa. Enjoy it and i wish you many happy moments to and fro wherever you go
1,Tone Club: Your subs has now expired 2 re-sub reply MONOC 4 monos or POLYC 4 polys 1 weekly @ 150p per week Txt STOP 2 stop This msg free Stream 0871212025016
1,Urgent Ur £500 guaranteed award is still unclaimed! Call 09066368327 NOW closingdate04/09/02 claimcode M39M51 £1.50pmmorefrommobile2Bremoved-MobyPOBox734LS27YF
1,"For ur chance to win £250 cash every wk TXT: PLAY to 83370. T's&C's www.music-trivia.net custcare 08715705022, 1x150p/wk."
0,"Aight, call me once you're close"
0,All sounds good. Fingers . Makes it difficult to type
1,+123 Congratulations - in this week's competition draw u have won the £1450 prize to claim just call 09050002311 b4280703. T&Cs/stop SMS 08718727868. Over 18 only 150ppm
0,S:)s.nervous  &lt;#&gt; :)
1,"You have won ?1,000 cash or a ?2,000 prize! To claim, call09050000327. T&C: RSTM, SW7 3SS. 150ppm"
0,"Sorry, I'll call later"
0,Guess which pub im in? Im as happy as a pig in clover or whatever the saying is! 
0,"Good afternoon sexy buns! How goes the job search ? I wake and you are my first thought as always, my love. I wish your fine and happy and know I adore you!"
0,"Hmmm ... And imagine after you've come home from that having to rub my feet, make me dinner and help me get ready for my date ! Are you sure your ready for that kind of life ?"
0,Lil fever:) now fine:)
0,If i said anything wrong sorry de:-)
0,But i juz remembered i gotta bathe my dog today..
0,Ok lar i double check wif da hair dresser already he said wun cut v short. He said will cut until i look nice.
1,Please call our customer service representative on 0800 169 6031 between 10am-9pm as you have WON a guaranteed £1000 cash or £5000 prize!
0,"Yo, you around? Just got my car back"
0,"Hey, a guy I know is breathing down my neck to get him some bud, anyway you'd be able to get a half track to usf tonight?"
1,Ever thought about living a good life with a perfect partner? Just txt back NAME and AGE to join the mobile community. (100p/SMS)
0,Hello which the site to download songs its urgent pls
0,Well obviously not because all the people in my cool college life went home ;_;
1,"FreeMsg Why haven't you replied to my text? I'm Randy, sexy, female and live local. Luv to hear from u. Netcollex Ltd 08700621170150p per msg reply Stop to end"
0,Hi neva worry bout da truth coz the truth will lead me 2 ur heart. Its the least a unique person like u deserve. Sleep tight or morning
0,Come to mahal bus stop.. &lt;DECIMAL&gt;
1,"Want to funk up ur fone with a weekly new tone reply TONES2U 2 this text. www.ringtones.co.uk, the original n best. Tones 3GBP network operator rates apply"
0,Fine. Do you remember me.
1,WINNER! As a valued network customer you hvae been selected to receive a £900 reward! To collect call 09061701444. Valid 24 hours only. ACL03530150PM
1,<Forwarded from 448712404000>Please CALL 08712404000 immediately as there is an urgent message waiting for you.
1,"Do you realize that in about 40 years, we'll have thousands of old ladies running around with tattoos?"
1,Ur ringtone service has changed! 25 Free credits! Go to club4mobiles.com to choose content now! Stop? txt CLUB STOP to 87070. 150p/wk Club4 PO Box1146 MK45 2WT
0,How long does applebees fucking take
1,INTERFLORA - It's not too late to order Interflora flowers for christmas call 0800 505060 to place your order before Midnight tomorrow.
0,Same to u...
0,Hi this is yijue... It's regarding the 3230 textbook it's intro to algorithms second edition... I'm selling it for $50...
1,Send a logo 2 ur lover - 2 names joined by a heart. Txt LOVE NAME1 NAME2 MOBNO eg LOVE ADAM EVE 07123456789 to 87077 Yahoo! POBox36504W45WQ TxtNO 4 no ads 150p
1,Refused a loan? Secured or Unsecured? Can't get credit? Call free now 0800 195 6669 or text back 'help' & we will!
1,"Latest News! Police station toilet stolen, cops have nothing to go on!"
1,Enjoy the jamster videosound gold club with your credits for 2 new videosounds+2 logos+musicnews! get more fun from jamster.co.uk! 16+only Help? call: 09701213186 
0,"My life Means a lot to me, Not because I love my life, But because I love the people in my life, The world calls them friends, I call them my World:-).. Ge:-).."
1,I am hot n horny and willing I live local to you - text a reply to hear strt back from me 150p per msg Netcollex LtdHelpDesk: 02085076972 reply Stop to end
0,Hurry home. Soup is DONE!
0,I'll reach in ard 20 mins ok...
0,No problem. How are you doing?
0,Yar lor wait 4 my mum 2 finish sch then have lunch lor... I whole morning stay at home clean my room now my room quite clean... Hee...
0,I went to ur hon lab but no one is there.
0,K.then any other special?
0,Hey tmr maybe can meet you at yck
0,Also remember the beads don't come off. Ever.
1,You have 1 new message. Call 0207-083-6089
